2025-11-30 19:58:32 | INFO     | ======================================================================
2025-11-30 19:58:32 | INFO     | MOB HUNTER v3.0 - FULL VERSION
2025-11-30 19:58:32 | INFO     | ======================================================================
2025-11-30 19:58:32 | INFO     | Log directory: logs/session_20251130_195832
2025-11-30 19:58:32 | INFO     | Screen: 1920x1080
2025-11-30 19:58:32 | INFO     | Overlay: ENABLED
2025-11-30 19:58:32 | INFO     | ======================================================================
2025-11-30 19:58:32 | INFO     | 
🚀 Bot started! Press Ctrl+C to stop.

2025-11-30 19:58:32 | INFO     | 
======================================================================
2025-11-30 19:58:32 | INFO     | CYCLE #1
2025-11-30 19:58:32 | INFO     | ======================================================================
2025-11-30 19:58:32 | INFO     | Detected: 8 floating names
2025-11-30 19:58:32 | INFO     |   ✓ Target #1 at (796, 799)
2025-11-30 19:58:32 | DEBUG    |   Name #2: Player zone
2025-11-30 19:58:32 | DEBUG    |   Name #3: Player zone
2025-11-30 19:58:32 | DEBUG    |   Name #4: Player zone
2025-11-30 19:58:32 | DEBUG    |   Name #5: Cached
2025-11-30 19:58:32 | DEBUG    |   Name #6: Player zone
2025-11-30 19:58:32 | INFO     |   ✓ Target #7 at (840, 340)
2025-11-30 19:58:32 | INFO     |   ✓ Target #8 at (975, 300)
2025-11-30 19:58:32 | INFO     | → Valid targets: 3
2025-11-30 19:58:32 | INFO     | 
  Verifying #1...
2025-11-30 19:58:32 | DEBUG    |     Clicking (796, 829)
2025-11-30 19:58:33 | DEBUG    |     Nameplate read in 1 attempts
2025-11-30 19:58:33 | INFO     |     ✓ Elite | HP: 69%
2025-11-30 19:58:33 | INFO     | 
  Verifying #2...
2025-11-30 19:58:33 | DEBUG    |     Clicking (840, 370)
2025-11-30 19:58:33 | DEBUG    |     Nameplate read in 1 attempts
2025-11-30 19:58:33 | INFO     |     ✓ Elite | HP: 69%
2025-11-30 19:58:33 | INFO     | 
>>>>>>>>>>>>>>>>>>>>>>>>>>>>>>>>>>>>>>>>>>>>>>>>>>
2025-11-30 19:58:33 | INFO     | ENGAGING: Elite (HP: 69%)
2025-11-30 19:58:33 | INFO     | >>>>>>>>>>>>>>>>>>>>>>>>>>>>>>>>>>>>>>>>>>>>>>>>>>
2025-11-30 19:58:33 | INFO     |   Skill 1: 1
2025-11-30 19:58:34 | INFO     |   Skill 2: 2
2025-11-30 19:58:34 | INFO     |   Skill 3: 3
2025-11-30 19:58:35 | INFO     |   Skill 4: 4
2025-11-30 19:58:36 | INFO     | <<<<<<<<<<<<<<<<<<<<<<<<<<<<<<<<<<<<<<<<<<<<<<<<<<
2025-11-30 19:58:36 | INFO     | Total engagements: 1

2025-11-30 19:58:36 | INFO     | 
======================================================================
2025-11-30 19:58:36 | INFO     | CYCLE #2
2025-11-30 19:58:36 | INFO     | ======================================================================
2025-11-30 19:58:36 | INFO     | Detected: 5 floating names
2025-11-30 19:58:36 | INFO     |   ✓ Target #1 at (1176, 820)
2025-11-30 19:58:36 | INFO     |   ✓ Target #2 at (332, 315)
2025-11-30 19:58:36 | INFO     |   ✓ Target #3 at (331, 257)
2025-11-30 19:58:36 | INFO     |   ✓ Target #4 at (1176, 729)
2025-11-30 19:58:36 | INFO     |   ✓ Target #5 at (240, 713)
2025-11-30 19:58:36 | INFO     | → Valid targets: 5
2025-11-30 19:58:36 | INFO     | 
  Verifying #1...
2025-11-30 19:58:36 | DEBUG    |     Clicking (1176, 851)
2025-11-30 19:58:37 | DEBUG    |     Nameplate read in 1 attempts
2025-11-30 19:58:37 | INFO     |     ✓ Elite | HP: 3%
2025-11-30 19:58:37 | INFO     | 
  Verifying #2...
2025-11-30 19:58:37 | DEBUG    |     Clicking (332, 346)
2025-11-30 19:58:37 | DEBUG    |     Nameplate read in 1 attempts
2025-11-30 19:58:37 | INFO     |     ✓ Elite | HP: 3%
2025-11-30 19:58:37 | INFO     | 
======================================================================
2025-11-30 19:58:37 | INFO     | CYCLE #3
2025-11-30 19:58:37 | INFO     | ======================================================================
2025-11-30 19:58:37 | INFO     | Detected: 6 floating names
2025-11-30 19:58:37 | DEBUG    |   Name #1: Cached
2025-11-30 19:58:37 | INFO     |   ✓ Target #2 at (1185, 309)
2025-11-30 19:58:37 | DEBUG    |   Name #3: Cached
2025-11-30 19:58:37 | DEBUG    |   Name #4: Cached
2025-11-30 19:58:37 | INFO     |   ✓ Target #5 at (1187, 263)
2025-11-30 19:58:37 | INFO     |   ✓ Target #6 at (1855, 191)
2025-11-30 19:58:37 | INFO     | → Valid targets: 3
2025-11-30 19:58:37 | INFO     | 
  Verifying #1...
2025-11-30 19:58:37 | DEBUG    |     Clicking (1185, 339)
2025-11-30 19:58:38 | DEBUG    |     Nameplate read in 1 attempts
2025-11-30 19:58:38 | INFO     |     ✓ Elite | HP: 3%
2025-11-30 19:58:38 | INFO     | 
  Verifying #2...
2025-11-30 19:58:38 | DEBUG    |     Clicking (1187, 293)
2025-11-30 19:58:38 | DEBUG    |     Nameplate read in 1 attempts
2025-11-30 19:58:38 | INFO     |     ✓ Elite | HP: 3%
2025-11-30 19:58:39 | INFO     | 
======================================================================
2025-11-30 19:58:39 | INFO     | CYCLE #4
2025-11-30 19:58:39 | INFO     | ======================================================================
2025-11-30 19:58:39 | INFO     | Detected: 6 floating names
2025-11-30 19:58:39 | DEBUG    |   Name #1: Player zone
2025-11-30 19:58:39 | DEBUG    |   Name #2: Cached
2025-11-30 19:58:39 | DEBUG    |   Name #3: Player zone
2025-11-30 19:58:39 | DEBUG    |   Name #4: Cached
2025-11-30 19:58:39 | INFO     |   ✓ Target #5 at (931, 351)
2025-11-30 19:58:39 | INFO     |   ✓ Target #6 at (998, 270)
2025-11-30 19:58:39 | INFO     | → Valid targets: 2
2025-11-30 19:58:39 | INFO     | 
  Verifying #1...
2025-11-30 19:58:39 | DEBUG    |     Clicking (931, 381)
2025-11-30 19:58:39 | DEBUG    |     Nameplate read in 1 attempts
2025-11-30 19:58:39 | INFO     |     ✓ Elite | HP: 3%
2025-11-30 19:58:39 | INFO     | 
  Verifying #2...
2025-11-30 19:58:39 | DEBUG    |     Clicking (998, 300)
2025-11-30 19:58:39 | DEBUG    |     Nameplate read in 1 attempts
2025-11-30 19:58:39 | INFO     |     ✓ Elite | HP: 3%
2025-11-30 19:58:40 | INFO     | 
======================================================================
2025-11-30 19:58:40 | INFO     | CYCLE #5
2025-11-30 19:58:40 | INFO     | ======================================================================
2025-11-30 19:58:40 | INFO     | Detected: 7 floating names
2025-11-30 19:58:40 | DEBUG    |   Name #1: Cached
2025-11-30 19:58:40 | DEBUG    |   Name #2: Cached
2025-11-30 19:58:40 | DEBUG    |   Name #3: Cached
2025-11-30 19:58:40 | DEBUG    |   Name #4: Cached
2025-11-30 19:58:40 | DEBUG    |   Name #5: Cached
2025-11-30 19:58:40 | DEBUG    |   Name #6: Cached
2025-11-30 19:58:40 | DEBUG    |   Name #7: Cached
2025-11-30 19:58:40 | INFO     | → Valid targets: 0
2025-11-30 19:58:40 | INFO     | 
======================================================================
2025-11-30 19:58:40 | INFO     | CYCLE #6
2025-11-30 19:58:40 | INFO     | ======================================================================
2025-11-30 19:58:40 | INFO     | Detected: 7 floating names
2025-11-30 19:58:40 | DEBUG    |   Name #1: Cached
2025-11-30 19:58:40 | DEBUG    |   Name #2: Cached
2025-11-30 19:58:40 | DEBUG    |   Name #3: Cached
2025-11-30 19:58:40 | DEBUG    |   Name #4: Cached
2025-11-30 19:58:40 | DEBUG    |   Name #5: Cached
2025-11-30 19:58:40 | DEBUG    |   Name #6: Cached
2025-11-30 19:58:40 | DEBUG    |   Name #7: Cached
2025-11-30 19:58:40 | INFO     | → Valid targets: 0
2025-11-30 19:58:41 | INFO     | 
======================================================================
2025-11-30 19:58:41 | INFO     | CYCLE #7
2025-11-30 19:58:41 | INFO     | ======================================================================
2025-11-30 19:58:41 | INFO     | Detected: 7 floating names
2025-11-30 19:58:41 | DEBUG    |   Name #1: Cached
2025-11-30 19:58:41 | DEBUG    |   Name #2: Cached
2025-11-30 19:58:41 | DEBUG    |   Name #3: Cached
2025-11-30 19:58:41 | DEBUG    |   Name #4: Cached
2025-11-30 19:58:41 | DEBUG    |   Name #5: Cached
2025-11-30 19:58:41 | DEBUG    |   Name #6: Cached
2025-11-30 19:58:41 | DEBUG    |   Name #7: Cached
2025-11-30 19:58:41 | INFO     | → Valid targets: 0
2025-11-30 19:58:41 | INFO     | 
======================================================================
2025-11-30 19:58:41 | INFO     | CYCLE #8
2025-11-30 19:58:41 | INFO     | ======================================================================
2025-11-30 19:58:41 | INFO     | Detected: 7 floating names
2025-11-30 19:58:41 | DEBUG    |   Name #1: Player zone
2025-11-30 19:58:41 | DEBUG    |   Name #2: Cached
2025-11-30 19:58:41 | DEBUG    |   Name #3: Player zone
2025-11-30 19:58:41 | DEBUG    |   Name #4: Cached
2025-11-30 19:58:41 | INFO     |   ✓ Target #5 at (933, 364)
2025-11-30 19:58:41 | INFO     |   ✓ Target #6 at (1001, 277)
2025-11-30 19:58:41 | DEBUG    |   Name #7: Player zone
2025-11-30 19:58:41 | INFO     | → Valid targets: 2
2025-11-30 19:58:41 | INFO     | 
  Verifying #1...
2025-11-30 19:58:41 | DEBUG    |     Clicking (933, 394)
2025-11-30 19:58:42 | DEBUG    |     Nameplate read in 1 attempts
2025-11-30 19:58:42 | INFO     |     ✓ Elite | HP: 100%
2025-11-30 19:58:42 | INFO     | 
  Verifying #2...
2025-11-30 19:58:42 | DEBUG    |     Clicking (1001, 307)
2025-11-30 19:58:42 | DEBUG    |     Nameplate read in 1 attempts
2025-11-30 19:58:42 | INFO     |     ✓ Elite | HP: 100%
2025-11-30 19:58:42 | INFO     | 
>>>>>>>>>>>>>>>>>>>>>>>>>>>>>>>>>>>>>>>>>>>>>>>>>>
2025-11-30 19:58:42 | INFO     | ENGAGING: Elite (HP: 100%)
2025-11-30 19:58:42 | INFO     | >>>>>>>>>>>>>>>>>>>>>>>>>>>>>>>>>>>>>>>>>>>>>>>>>>
2025-11-30 19:58:42 | INFO     |   Skill 1: 1
2025-11-30 19:58:43 | INFO     |   Skill 2: 2
2025-11-30 19:58:43 | INFO     |   Skill 3: 3
2025-11-30 19:58:44 | INFO     |   Skill 4: 4
2025-11-30 19:58:45 | INFO     | <<<<<<<<<<<<<<<<<<<<<<<<<<<<<<<<<<<<<<<<<<<<<<<<<<
2025-11-30 19:58:45 | INFO     | Total engagements: 2

2025-11-30 19:58:45 | INFO     | 
======================================================================
2025-11-30 19:58:45 | INFO     | CYCLE #9
2025-11-30 19:58:45 | INFO     | ======================================================================
2025-11-30 19:58:45 | INFO     | Detected: 1 floating names
2025-11-30 19:58:45 | DEBUG    |   Name #1: Player zone
2025-11-30 19:58:45 | INFO     | → Valid targets: 0
2025-11-30 19:58:46 | INFO     | 
======================================================================
2025-11-30 19:58:46 | INFO     | CYCLE #10
2025-11-30 19:58:46 | INFO     | ======================================================================
2025-11-30 19:58:46 | INFO     | Detected: 2 floating names
2025-11-30 19:58:46 | INFO     |   ✓ Target #1 at (100, 139)
2025-11-30 19:58:46 | INFO     |   ✓ Target #2 at (953, 132)
2025-11-30 19:58:46 | INFO     | → Valid targets: 2
2025-11-30 19:58:46 | INFO     | 
  Verifying #1...
2025-11-30 19:58:46 | DEBUG    |     Clicking (100, 169)
2025-11-30 19:58:46 | DEBUG    |     Nameplate read in 1 attempts
2025-11-30 19:58:46 | INFO     |     ✓ Elite | HP: 100%
2025-11-30 19:58:46 | INFO     | 
  Verifying #2...
2025-11-30 19:58:46 | DEBUG    |     Clicking (953, 162)
2025-11-30 19:58:47 | DEBUG    |     Nameplate read in 1 attempts
2025-11-30 19:58:47 | INFO     |     ✓ Elite | HP: 100%
2025-11-30 19:58:47 | INFO     | 
>>>>>>>>>>>>>>>>>>>>>>>>>>>>>>>>>>>>>>>>>>>>>>>>>>
2025-11-30 19:58:47 | INFO     | ENGAGING: Elite (HP: 100%)
2025-11-30 19:58:47 | INFO     | >>>>>>>>>>>>>>>>>>>>>>>>>>>>>>>>>>>>>>>>>>>>>>>>>>
2025-11-30 19:58:47 | INFO     |   Skill 1: 1
2025-11-30 19:58:47 | INFO     |   Skill 2: 2
2025-11-30 19:58:48 | INFO     |   Skill 3: 3
2025-11-30 19:58:49 | INFO     |   Skill 4: 4
2025-11-30 19:58:49 | INFO     | <<<<<<<<<<<<<<<<<<<<<<<<<<<<<<<<<<<<<<<<<<<<<<<<<<
2025-11-30 19:58:49 | INFO     | Total engagements: 3

2025-11-30 19:58:50 | INFO     | 
======================================================================
2025-11-30 19:58:50 | INFO     | CYCLE #11
2025-11-30 19:58:50 | INFO     | ======================================================================
2025-11-30 19:58:50 | INFO     | Detected: 0 floating names
2025-11-30 19:58:50 | INFO     | 
======================================================================
2025-11-30 19:58:50 | INFO     | CYCLE #12
2025-11-30 19:58:50 | INFO     | ======================================================================
2025-11-30 19:58:50 | INFO     | Detected: 10 floating names
2025-11-30 19:58:50 | INFO     |   ✓ Target #1 at (789, 853)
2025-11-30 19:58:50 | DEBUG    |   Name #2: Player zone
2025-11-30 19:58:50 | DEBUG    |   Name #3: Player zone
2025-11-30 19:58:50 | DEBUG    |   Region near center, might be player
2025-11-30 19:58:50 | DEBUG    |   Name #5: Cached
2025-11-30 19:58:50 | DEBUG    |   Region near center, might be player
2025-11-30 19:58:50 | INFO     |   ✓ Target #7 at (1098, 378)
2025-11-30 19:58:50 | INFO     |   ✓ Target #8 at (414, 332)
2025-11-30 19:58:50 | INFO     |   ✓ Target #9 at (538, 332)
2025-11-30 19:58:50 | INFO     |   ✓ Target #10 at (717, 883)
2025-11-30 19:58:50 | INFO     | → Valid targets: 5
2025-11-30 19:58:50 | INFO     | 
  Verifying #1...
2025-11-30 19:58:50 | DEBUG    |     Clicking (789, 883)
2025-11-30 19:58:51 | DEBUG    |     Nameplate read in 1 attempts
2025-11-30 19:58:51 | INFO     |     ✓ General | HP: 100%
2025-11-30 19:58:51 | INFO     | 
  Verifying #2...
2025-11-30 19:58:51 | DEBUG    |     Clicking (1098, 408)
2025-11-30 19:58:51 | DEBUG    |     Nameplate read in 1 attempts
2025-11-30 19:58:51 | INFO     |     ✓ General | HP: 100%
2025-11-30 19:58:51 | INFO     | 
>>>>>>>>>>>>>>>>>>>>>>>>>>>>>>>>>>>>>>>>>>>>>>>>>>
2025-11-30 19:58:51 | INFO     | ENGAGING: General (HP: 100%)
2025-11-30 19:58:51 | INFO     | >>>>>>>>>>>>>>>>>>>>>>>>>>>>>>>>>>>>>>>>>>>>>>>>>>
2025-11-30 19:58:51 | INFO     |   Skill 1: 1
2025-11-30 19:58:52 | INFO     |   Skill 2: 2
2025-11-30 19:58:53 | INFO     |   Skill 3: 3
2025-11-30 19:58:53 | INFO     |   Skill 4: 4
2025-11-30 19:58:54 | INFO     | <<<<<<<<<<<<<<<<<<<<<<<<<<<<<<<<<<<<<<<<<<<<<<<<<<
2025-11-30 19:58:54 | INFO     | Total engagements: 4

2025-11-30 19:58:54 | INFO     | 
======================================================================
2025-11-30 19:58:54 | INFO     | CYCLE #13
2025-11-30 19:58:54 | INFO     | ======================================================================
2025-11-30 19:58:54 | INFO     | Detected: 14 floating names
2025-11-30 19:58:54 | DEBUG    |   Name #1: Player zone
2025-11-30 19:58:54 | DEBUG    |   Region near center, might be player
2025-11-30 19:58:54 | DEBUG    |   Name #3: Player zone
2025-11-30 19:58:54 | DEBUG    |   Region near center, might be player
2025-11-30 19:58:54 | DEBUG    |   Region near center, might be player
2025-11-30 19:58:54 | DEBUG    |   Region near center, might be player
2025-11-30 19:58:54 | DEBUG    |   Name #7: Cached
2025-11-30 19:58:54 | DEBUG    |   Name #8: Cached
2025-11-30 19:58:54 | DEBUG    |   Region near center, might be player
2025-11-30 19:58:54 | INFO     |   ✓ Target #10 at (900, 316)
2025-11-30 19:58:54 | INFO     |   ✓ Target #11 at (1237, 267)
2025-11-30 19:58:54 | INFO     |   ✓ Target #12 at (1152, 246)
2025-11-30 19:58:54 | INFO     |   ✓ Target #13 at (974, 241)
2025-11-30 19:58:54 | DEBUG    |   Name #14: Cached
2025-11-30 19:58:54 | INFO     | → Valid targets: 4
2025-11-30 19:58:54 | INFO     | 
  Verifying #1...
2025-11-30 19:58:54 | DEBUG    |     Clicking (900, 346)
2025-11-30 19:58:55 | DEBUG    |     Nameplate read in 1 attempts
2025-11-30 19:58:55 | INFO     |     ✓ Elite | HP: 69%
2025-11-30 19:58:55 | INFO     | 
  Verifying #2...
2025-11-30 19:58:55 | DEBUG    |     Clicking (1237, 298)
2025-11-30 19:58:55 | DEBUG    |     Nameplate read in 1 attempts
2025-11-30 19:58:55 | INFO     |     ✓ Elite | HP: 69%
2025-11-30 19:58:55 | INFO     | 
>>>>>>>>>>>>>>>>>>>>>>>>>>>>>>>>>>>>>>>>>>>>>>>>>>
2025-11-30 19:58:55 | INFO     | ENGAGING: Elite (HP: 69%)
2025-11-30 19:58:55 | INFO     | >>>>>>>>>>>>>>>>>>>>>>>>>>>>>>>>>>>>>>>>>>>>>>>>>>
2025-11-30 19:58:55 | INFO     |   Skill 1: 1
2025-11-30 19:58:56 | INFO     |   Skill 2: 2
2025-11-30 19:58:57 | INFO     |   Skill 3: 3
2025-11-30 19:58:57 | INFO     |   Skill 4: 4
2025-11-30 19:58:58 | INFO     | <<<<<<<<<<<<<<<<<<<<<<<<<<<<<<<<<<<<<<<<<<<<<<<<<<
2025-11-30 19:58:58 | INFO     | Total engagements: 5

2025-11-30 19:58:58 | INFO     | 
======================================================================
2025-11-30 19:58:58 | INFO     | CYCLE #14
2025-11-30 19:58:58 | INFO     | ======================================================================
2025-11-30 19:58:58 | INFO     | Detected: 1 floating names
2025-11-30 19:58:58 | DEBUG    |   Name #1: Player zone
2025-11-30 19:58:58 | INFO     | → Valid targets: 0
2025-11-30 19:58:59 | INFO     | 
======================================================================
2025-11-30 19:58:59 | INFO     | CYCLE #15
2025-11-30 19:58:59 | INFO     | ======================================================================
2025-11-30 19:58:59 | INFO     | Detected: 2 floating names
2025-11-30 19:58:59 | INFO     |   ✓ Target #1 at (100, 139)
2025-11-30 19:58:59 | INFO     |   ✓ Target #2 at (953, 132)
2025-11-30 19:58:59 | INFO     | → Valid targets: 2
2025-11-30 19:58:59 | INFO     | 
  Verifying #1...
2025-11-30 19:58:59 | DEBUG    |     Clicking (100, 169)
2025-11-30 19:58:59 | DEBUG    |     Nameplate read in 1 attempts
2025-11-30 19:58:59 | INFO     |     ✓ Elite | HP: 69%
2025-11-30 19:58:59 | INFO     | 
  Verifying #2...
2025-11-30 19:58:59 | DEBUG    |     Clicking (953, 162)
2025-11-30 19:59:00 | DEBUG    |     Nameplate read in 1 attempts
2025-11-30 19:59:00 | INFO     |     ✓ Elite | HP: 69%
2025-11-30 19:59:00 | INFO     | 
>>>>>>>>>>>>>>>>>>>>>>>>>>>>>>>>>>>>>>>>>>>>>>>>>>
2025-11-30 19:59:00 | INFO     | ENGAGING: Elite (HP: 69%)
2025-11-30 19:59:00 | INFO     | >>>>>>>>>>>>>>>>>>>>>>>>>>>>>>>>>>>>>>>>>>>>>>>>>>
2025-11-30 19:59:00 | INFO     |   Skill 1: 1
2025-11-30 19:59:00 | INFO     |   Skill 2: 2
2025-11-30 19:59:01 | INFO     |   Skill 3: 3
2025-11-30 19:59:02 | INFO     |   Skill 4: 4
2025-11-30 19:59:02 | INFO     | <<<<<<<<<<<<<<<<<<<<<<<<<<<<<<<<<<<<<<<<<<<<<<<<<<
2025-11-30 19:59:02 | INFO     | Total engagements: 6

2025-11-30 19:59:03 | INFO     | 
======================================================================
2025-11-30 19:59:03 | INFO     | CYCLE #16
2025-11-30 19:59:03 | INFO     | ======================================================================
2025-11-30 19:59:03 | INFO     | Detected: 0 floating names
2025-11-30 19:59:03 | INFO     | 
======================================================================
2025-11-30 19:59:03 | INFO     | CYCLE #17
2025-11-30 19:59:03 | INFO     | ======================================================================
2025-11-30 19:59:03 | INFO     | Detected: 0 floating names
2025-11-30 19:59:04 | INFO     | 
======================================================================
2025-11-30 19:59:04 | INFO     | CYCLE #18
2025-11-30 19:59:04 | INFO     | ======================================================================
2025-11-30 19:59:04 | INFO     | Detected: 0 floating names
2025-11-30 19:59:04 | INFO     | 
======================================================================
2025-11-30 19:59:04 | INFO     | CYCLE #19
2025-11-30 19:59:04 | INFO     | ======================================================================
2025-11-30 19:59:04 | INFO     | Detected: 0 floating names
2025-11-30 19:59:05 | INFO     | 
======================================================================
2025-11-30 19:59:05 | INFO     | CYCLE #20
2025-11-30 19:59:05 | INFO     | ======================================================================
2025-11-30 19:59:05 | INFO     | Detected: 0 floating names
2025-11-30 19:59:05 | INFO     | 
======================================================================
2025-11-30 19:59:05 | INFO     | CYCLE #21
2025-11-30 19:59:05 | INFO     | ======================================================================
2025-11-30 19:59:05 | INFO     | Detected: 0 floating names
2025-11-30 19:59:06 | INFO     | 
======================================================================
2025-11-30 19:59:06 | INFO     | CYCLE #22
2025-11-30 19:59:06 | INFO     | ======================================================================
2025-11-30 19:59:06 | INFO     | Detected: 0 floating names
2025-11-30 19:59:06 | INFO     | 
======================================================================
2025-11-30 19:59:06 | INFO     | CYCLE #23
2025-11-30 19:59:06 | INFO     | ======================================================================
2025-11-30 19:59:06 | INFO     | Detected: 0 floating names
2025-11-30 19:59:06 | INFO     | 
======================================================================
2025-11-30 19:59:06 | INFO     | CYCLE #24
2025-11-30 19:59:06 | INFO     | ======================================================================
2025-11-30 19:59:06 | INFO     | Detected: 0 floating names
2025-11-30 19:59:07 | INFO     | 
======================================================================
2025-11-30 19:59:07 | INFO     | CYCLE #25
2025-11-30 19:59:07 | INFO     | ======================================================================
2025-11-30 19:59:07 | INFO     | Detected: 0 floating names
2025-11-30 19:59:07 | INFO     | 
======================================================================
2025-11-30 19:59:07 | INFO     | CYCLE #26
2025-11-30 19:59:07 | INFO     | ======================================================================
2025-11-30 19:59:07 | INFO     | Detected: 0 floating names
2025-11-30 19:59:08 | INFO     | 
======================================================================
2025-11-30 19:59:08 | INFO     | CYCLE #27
2025-11-30 19:59:08 | INFO     | ======================================================================
2025-11-30 19:59:08 | INFO     | Detected: 0 floating names
2025-11-30 19:59:08 | INFO     | 
======================================================================
2025-11-30 19:59:08 | INFO     | CYCLE #28
2025-11-30 19:59:08 | INFO     | ======================================================================
2025-11-30 19:59:08 | INFO     | Detected: 0 floating names
2025-11-30 19:59:09 | INFO     | 
======================================================================
2025-11-30 19:59:09 | INFO     | CYCLE #29
2025-11-30 19:59:09 | INFO     | ======================================================================
2025-11-30 19:59:09 | INFO     | Detected: 0 floating names
2025-11-30 19:59:09 | INFO     | 
======================================================================
2025-11-30 19:59:09 | INFO     | CYCLE #30
2025-11-30 19:59:09 | INFO     | ======================================================================
2025-11-30 19:59:09 | INFO     | Detected: 0 floating names
2025-11-30 19:59:10 | INFO     | 
======================================================================
2025-11-30 19:59:10 | INFO     | CYCLE #31
2025-11-30 19:59:10 | INFO     | ======================================================================
2025-11-30 19:59:10 | INFO     | Detected: 0 floating names
2025-11-30 19:59:10 | INFO     | 
======================================================================
2025-11-30 19:59:10 | INFO     | CYCLE #32
2025-11-30 19:59:10 | INFO     | ======================================================================
2025-11-30 19:59:10 | INFO     | Detected: 0 floating names
2025-11-30 19:59:10 | INFO     | 
======================================================================
2025-11-30 19:59:10 | INFO     | CYCLE #33
2025-11-30 19:59:10 | INFO     | ======================================================================
2025-11-30 19:59:10 | INFO     | Detected: 0 floating names
2025-11-30 19:59:11 | INFO     | 
======================================================================
2025-11-30 19:59:11 | INFO     | CYCLE #34
2025-11-30 19:59:11 | INFO     | ======================================================================
2025-11-30 19:59:11 | INFO     | Detected: 0 floating names
2025-11-30 19:59:11 | INFO     | 
======================================================================
2025-11-30 19:59:11 | INFO     | CYCLE #35
2025-11-30 19:59:11 | INFO     | ======================================================================
2025-11-30 19:59:11 | INFO     | Detected: 0 floating names
2025-11-30 19:59:12 | INFO     | 
======================================================================
2025-11-30 19:59:12 | INFO     | CYCLE #36
2025-11-30 19:59:12 | INFO     | ======================================================================
2025-11-30 19:59:12 | INFO     | Detected: 0 floating names
2025-11-30 19:59:12 | INFO     | 
======================================================================
2025-11-30 19:59:12 | INFO     | CYCLE #37
2025-11-30 19:59:12 | INFO     | ======================================================================
2025-11-30 19:59:12 | INFO     | Detected: 0 floating names
2025-11-30 19:59:13 | INFO     | 
======================================================================
2025-11-30 19:59:13 | INFO     | CYCLE #38
2025-11-30 19:59:13 | INFO     | ======================================================================
2025-11-30 19:59:13 | INFO     | Detected: 0 floating names
2025-11-30 19:59:13 | INFO     | 
======================================================================
2025-11-30 19:59:13 | INFO     | CYCLE #39
2025-11-30 19:59:13 | INFO     | ======================================================================
2025-11-30 19:59:13 | INFO     | Detected: 3 floating names
2025-11-30 19:59:13 | INFO     |   ✓ Target #1 at (1077, 712)
2025-11-30 19:59:13 | INFO     |   ✓ Target #2 at (1019, 710)
2025-11-30 19:59:13 | INFO     |   ✓ Target #3 at (1561, 175)
2025-11-30 19:59:13 | INFO     | → Valid targets: 3
2025-11-30 19:59:13 | INFO     | 
  Verifying #1...
2025-11-30 19:59:13 | DEBUG    |     Clicking (1077, 744)
2025-11-30 19:59:14 | DEBUG    |     Nameplate read in 1 attempts
2025-11-30 19:59:14 | INFO     |     ✓ Elite | HP: 3%
2025-11-30 19:59:14 | INFO     | 
  Verifying #2...
2025-11-30 19:59:14 | DEBUG    |     Clicking (1019, 744)
2025-11-30 19:59:14 | DEBUG    |     Nameplate read in 1 attempts
2025-11-30 19:59:14 | INFO     |     ✓ Elite | HP: 3%
2025-11-30 19:59:14 | INFO     | 
======================================================================
2025-11-30 19:59:14 | INFO     | CYCLE #40
2025-11-30 19:59:14 | INFO     | ======================================================================
2025-11-30 19:59:14 | INFO     | Detected: 6 floating names
2025-11-30 19:59:14 | DEBUG    |   Region near center, might be player
2025-11-30 19:59:14 | DEBUG    |   Region near center, might be player
2025-11-30 19:59:14 | DEBUG    |   Name #3: Player zone
2025-11-30 19:59:14 | DEBUG    |   Region near center, might be player
2025-11-30 19:59:14 | DEBUG    |   Region near center, might be player
2025-11-30 19:59:14 | DEBUG    |   Name #6: Cached
2025-11-30 19:59:14 | INFO     | → Valid targets: 0
2025-11-30 19:59:15 | INFO     | 
======================================================================
2025-11-30 19:59:15 | INFO     | CYCLE #41
2025-11-30 19:59:15 | INFO     | ======================================================================
2025-11-30 19:59:15 | INFO     | Detected: 6 floating names
2025-11-30 19:59:15 | DEBUG    |   Name #1: Cached
2025-11-30 19:59:15 | DEBUG    |   Name #2: Cached
2025-11-30 19:59:15 | DEBUG    |   Name #3: Cached
2025-11-30 19:59:15 | DEBUG    |   Name #4: Cached
2025-11-30 19:59:15 | DEBUG    |   Name #5: Cached
2025-11-30 19:59:15 | DEBUG    |   Name #6: Cached
2025-11-30 19:59:15 | INFO     | → Valid targets: 0
2025-11-30 19:59:15 | INFO     | 

⛔ Bot stopped by user
2025-11-30 19:59:15 | INFO     | 
======================================================================
2025-11-30 19:59:15 | INFO     | FINAL STATISTICS
2025-11-30 19:59:15 | INFO     | ======================================================================
2025-11-30 19:59:15 | INFO     | Total Cycles: 41
2025-11-30 19:59:15 | INFO     | Total Clicks: 20
2025-11-30 19:59:15 | INFO     | Total Engagements: 6
2025-11-30 19:59:15 | INFO     | Uptime: 43s (0m 43s)
2025-11-30 19:59:15 | INFO     | Cache Hit Rate: 40.8%
2025-11-30 19:59:15 | INFO     | Avg Cycle Time: 1.05s
2025-11-30 19:59:15 | INFO     | ======================================================================
