2025-11-30 20:24:18 | INFO     | ======================================================================
2025-11-30 20:24:18 | INFO     | MOB HUNTER v3.0 - FULL VERSION
2025-11-30 20:24:18 | INFO     | ======================================================================
2025-11-30 20:24:18 | INFO     | Log directory: logs/session_20251130_202418
2025-11-30 20:24:18 | INFO     | Screen: 1920x1080
2025-11-30 20:24:18 | INFO     | Overlay: ENABLED
2025-11-30 20:24:18 | INFO     | ======================================================================
2025-11-30 20:24:18 | INFO     | 
🚀 Bot started! Press Ctrl+C to stop.

2025-11-30 20:24:18 | INFO     | 
======================================================================
2025-11-30 20:24:18 | INFO     | CYCLE #1
2025-11-30 20:24:18 | INFO     | ======================================================================
2025-11-30 20:24:18 | INFO     | Detected: 10 floating names
2025-11-30 20:24:18 | DEBUG    |   Region near center, might be player
2025-11-30 20:24:18 | DEBUG    |   Name #2: Player zone
2025-11-30 20:24:18 | DEBUG    |   Name #3: Player zone
2025-11-30 20:24:18 | DEBUG    |   Name #4: Player zone
2025-11-30 20:24:18 | DEBUG    |   Name #5: Cached
2025-11-30 20:24:18 | DEBUG    |   Region near center, might be player
2025-11-30 20:24:18 | INFO     |   ✓ Target #7 at (1327, 227)
2025-11-30 20:24:18 | DEBUG    |   Name #8: Cached
2025-11-30 20:24:18 | DEBUG    |   Name #9: Cached
2025-11-30 20:24:18 | DEBUG    |   Name #10: Player zone
2025-11-30 20:24:18 | INFO     | → Valid targets: 1
2025-11-30 20:24:18 | INFO     | 
  Verifying #1...
2025-11-30 20:24:18 | DEBUG    |     Clicking (1327, 258)
2025-11-30 20:24:19 | DEBUG    |     Nameplate read in 1 attempts
2025-11-30 20:24:19 | INFO     |     ✓ Elite | HP: 69%
2025-11-30 20:24:19 | INFO     | 
>>>>>>>>>>>>>>>>>>>>>>>>>>>>>>>>>>>>>>>>>>>>>>>>>>
2025-11-30 20:24:19 | INFO     | ENGAGING: Elite (HP: 69%)
2025-11-30 20:24:19 | INFO     | >>>>>>>>>>>>>>>>>>>>>>>>>>>>>>>>>>>>>>>>>>>>>>>>>>
2025-11-30 20:24:19 | INFO     |   Skill 1: 1
2025-11-30 20:24:19 | INFO     |   Skill 2: 2
2025-11-30 20:24:20 | INFO     |   Skill 3: 3
2025-11-30 20:24:21 | INFO     |   Skill 4: 4
2025-11-30 20:24:21 | INFO     | <<<<<<<<<<<<<<<<<<<<<<<<<<<<<<<<<<<<<<<<<<<<<<<<<<
2025-11-30 20:24:21 | INFO     | Total engagements: 1

2025-11-30 20:24:22 | INFO     | 
======================================================================
2025-11-30 20:24:22 | INFO     | CYCLE #2
2025-11-30 20:24:22 | INFO     | ======================================================================
2025-11-30 20:24:22 | INFO     | Detected: 9 floating names
2025-11-30 20:24:22 | DEBUG    |   Region near center, might be player
2025-11-30 20:24:22 | DEBUG    |   Name #2: Player zone
2025-11-30 20:24:22 | DEBUG    |   Name #3: Cached
2025-11-30 20:24:22 | DEBUG    |   Region near center, might be player
2025-11-30 20:24:22 | DEBUG    |   Name #5: Player zone
2025-11-30 20:24:22 | DEBUG    |   Region near center, might be player
2025-11-30 20:24:22 | INFO     |   ✓ Target #7 at (1207, 264)
2025-11-30 20:24:22 | INFO     |   ✓ Target #8 at (1138, 219)
2025-11-30 20:24:22 | DEBUG    |   Name #9: Cached
2025-11-30 20:24:22 | INFO     | → Valid targets: 2
2025-11-30 20:24:22 | INFO     | 
  Verifying #1...
2025-11-30 20:24:22 | DEBUG    |     Clicking (1207, 295)
2025-11-30 20:24:22 | DEBUG    |     Nameplate read in 1 attempts
2025-11-30 20:24:22 | INFO     |     ✓ Elite | HP: 3%
2025-11-30 20:24:22 | INFO     | 
  Verifying #2...
2025-11-30 20:24:22 | DEBUG    |     Clicking (1138, 250)
2025-11-30 20:24:23 | DEBUG    |     Nameplate read in 1 attempts
2025-11-30 20:24:23 | INFO     |     ✓ Elite | HP: 3%
2025-11-30 20:24:23 | INFO     | 
======================================================================
2025-11-30 20:24:23 | INFO     | CYCLE #3
2025-11-30 20:24:23 | INFO     | ======================================================================
2025-11-30 20:24:23 | INFO     | Detected: 8 floating names
2025-11-30 20:24:23 | INFO     |   ✓ Target #1 at (750, 794)
2025-11-30 20:24:23 | INFO     |   ✓ Target #2 at (658, 751)
2025-11-30 20:24:23 | DEBUG    |   Name #3: Cached
2025-11-30 20:24:23 | INFO     |   ✓ Target #4 at (1220, 717)
2025-11-30 20:24:23 | DEBUG    |   Name #5: Player zone
2025-11-30 20:24:23 | DEBUG    |   Name #6: Cached
2025-11-30 20:24:23 | DEBUG    |   Name #7: Cached
2025-11-30 20:24:23 | INFO     |   ✓ Target #8 at (1161, 347)
2025-11-30 20:24:23 | INFO     | → Valid targets: 4
2025-11-30 20:24:23 | INFO     | 
  Verifying #1...
2025-11-30 20:24:23 | DEBUG    |     Clicking (750, 825)
2025-11-30 20:24:24 | DEBUG    |     Nameplate read in 1 attempts
2025-11-30 20:24:24 | INFO     |     ✓ Elite | HP: 69%
2025-11-30 20:24:24 | INFO     | 
  Verifying #2...
2025-11-30 20:24:24 | DEBUG    |     Clicking (658, 781)
2025-11-30 20:24:24 | DEBUG    |     Nameplate read in 1 attempts
2025-11-30 20:24:24 | INFO     |     ✓ Elite | HP: 69%
2025-11-30 20:24:24 | INFO     | 
>>>>>>>>>>>>>>>>>>>>>>>>>>>>>>>>>>>>>>>>>>>>>>>>>>
2025-11-30 20:24:24 | INFO     | ENGAGING: Elite (HP: 69%)
2025-11-30 20:24:24 | INFO     | >>>>>>>>>>>>>>>>>>>>>>>>>>>>>>>>>>>>>>>>>>>>>>>>>>
2025-11-30 20:24:24 | INFO     |   Skill 1: 1
2025-11-30 20:24:25 | INFO     |   Skill 2: 2
2025-11-30 20:24:25 | INFO     |   Skill 3: 3
2025-11-30 20:24:26 | INFO     |   Skill 4: 4
2025-11-30 20:24:27 | INFO     | <<<<<<<<<<<<<<<<<<<<<<<<<<<<<<<<<<<<<<<<<<<<<<<<<<
2025-11-30 20:24:27 | INFO     | Total engagements: 2

2025-11-30 20:24:27 | INFO     | 
======================================================================
2025-11-30 20:24:27 | INFO     | CYCLE #4
2025-11-30 20:24:27 | INFO     | ======================================================================
2025-11-30 20:24:27 | INFO     | Detected: 8 floating names
2025-11-30 20:24:27 | INFO     |   ✓ Target #1 at (948, 755)
2025-11-30 20:24:27 | DEBUG    |   Name #2: Player zone
2025-11-30 20:24:27 | DEBUG    |   Name #3: Cached
2025-11-30 20:24:27 | DEBUG    |   Name #4: Player zone
2025-11-30 20:24:27 | DEBUG    |   Region near center, might be player
2025-11-30 20:24:27 | DEBUG    |   Name #6: Cached
2025-11-30 20:24:27 | DEBUG    |   Name #7: Player zone
2025-11-30 20:24:27 | DEBUG    |   Name #8: Cached
2025-11-30 20:24:27 | INFO     | → Valid targets: 1
2025-11-30 20:24:27 | INFO     | 
  Verifying #1...
2025-11-30 20:24:27 | DEBUG    |     Clicking (948, 786)
2025-11-30 20:24:28 | DEBUG    |     Nameplate read in 1 attempts
2025-11-30 20:24:28 | INFO     |     ✓ Elite | HP: 3%
2025-11-30 20:24:28 | INFO     | 
======================================================================
2025-11-30 20:24:28 | INFO     | CYCLE #5
2025-11-30 20:24:28 | INFO     | ======================================================================
2025-11-30 20:24:28 | INFO     | Detected: 8 floating names
2025-11-30 20:24:28 | DEBUG    |   Region near center, might be player
2025-11-30 20:24:28 | DEBUG    |   Name #2: Cached
2025-11-30 20:24:28 | DEBUG    |   Name #3: Cached
2025-11-30 20:24:28 | DEBUG    |   Region near center, might be player
2025-11-30 20:24:28 | DEBUG    |   Name #5: Cached
2025-11-30 20:24:28 | INFO     |   ✓ Target #6 at (1377, 360)
2025-11-30 20:24:28 | INFO     |   ✓ Target #7 at (1074, 329)
2025-11-30 20:24:28 | DEBUG    |   Name #8: Cached
2025-11-30 20:24:28 | INFO     | → Valid targets: 2
2025-11-30 20:24:28 | INFO     | 
  Verifying #1...
2025-11-30 20:24:28 | DEBUG    |     Clicking (1377, 391)
2025-11-30 20:24:28 | DEBUG    |     Nameplate read in 1 attempts
2025-11-30 20:24:28 | INFO     |     ✓ Elite | HP: 69%
2025-11-30 20:24:28 | INFO     | 
  Verifying #2...
2025-11-30 20:24:28 | DEBUG    |     Clicking (1074, 359)
2025-11-30 20:24:29 | DEBUG    |     Nameplate read in 1 attempts
2025-11-30 20:24:29 | INFO     |     ✓ Elite | HP: 69%
2025-11-30 20:24:29 | INFO     | 
>>>>>>>>>>>>>>>>>>>>>>>>>>>>>>>>>>>>>>>>>>>>>>>>>>
2025-11-30 20:24:29 | INFO     | ENGAGING: Elite (HP: 69%)
2025-11-30 20:24:29 | INFO     | >>>>>>>>>>>>>>>>>>>>>>>>>>>>>>>>>>>>>>>>>>>>>>>>>>
2025-11-30 20:24:29 | INFO     |   Skill 1: 1
2025-11-30 20:24:29 | INFO     |   Skill 2: 2
2025-11-30 20:24:30 | INFO     |   Skill 3: 3
2025-11-30 20:24:31 | INFO     |   Skill 4: 4
2025-11-30 20:24:32 | INFO     | <<<<<<<<<<<<<<<<<<<<<<<<<<<<<<<<<<<<<<<<<<<<<<<<<<
2025-11-30 20:24:32 | INFO     | Total engagements: 3

2025-11-30 20:24:32 | INFO     | 
======================================================================
2025-11-30 20:24:32 | INFO     | CYCLE #6
2025-11-30 20:24:32 | INFO     | ======================================================================
2025-11-30 20:24:32 | INFO     | Detected: 5 floating names
2025-11-30 20:24:32 | DEBUG    |   Name #1: Player zone
2025-11-30 20:24:32 | DEBUG    |   Region near center, might be player
2025-11-30 20:24:32 | DEBUG    |   Name #3: Player zone
2025-11-30 20:24:32 | DEBUG    |   Name #4: Player zone
2025-11-30 20:24:32 | DEBUG    |   Name #5: Player zone
2025-11-30 20:24:32 | INFO     | → Valid targets: 0
2025-11-30 20:24:32 | INFO     | 
======================================================================
2025-11-30 20:24:32 | INFO     | CYCLE #7
2025-11-30 20:24:32 | INFO     | ======================================================================
2025-11-30 20:24:33 | INFO     | Detected: 4 floating names
2025-11-30 20:24:33 | DEBUG    |   Name #1: Cached
2025-11-30 20:24:33 | DEBUG    |   Name #2: Cached
2025-11-30 20:24:33 | DEBUG    |   Name #3: Cached
2025-11-30 20:24:33 | DEBUG    |   Name #4: Cached
2025-11-30 20:24:33 | INFO     | → Valid targets: 0
2025-11-30 20:24:33 | INFO     | 
======================================================================
2025-11-30 20:24:33 | INFO     | CYCLE #8
2025-11-30 20:24:33 | INFO     | ======================================================================
2025-11-30 20:24:33 | INFO     | Detected: 4 floating names
2025-11-30 20:24:33 | DEBUG    |   Name #1: Cached
2025-11-30 20:24:33 | DEBUG    |   Name #2: Cached
2025-11-30 20:24:33 | DEBUG    |   Name #3: Cached
2025-11-30 20:24:33 | DEBUG    |   Name #4: Cached
2025-11-30 20:24:33 | INFO     | → Valid targets: 0
2025-11-30 20:24:33 | INFO     | 
======================================================================
2025-11-30 20:24:33 | INFO     | CYCLE #9
2025-11-30 20:24:33 | INFO     | ======================================================================
2025-11-30 20:24:33 | INFO     | Detected: 4 floating names
2025-11-30 20:24:33 | DEBUG    |   Name #1: Cached
2025-11-30 20:24:33 | DEBUG    |   Name #2: Cached
2025-11-30 20:24:33 | DEBUG    |   Name #3: Cached
2025-11-30 20:24:33 | DEBUG    |   Name #4: Cached
2025-11-30 20:24:33 | INFO     | → Valid targets: 0
2025-11-30 20:24:34 | INFO     | 
======================================================================
2025-11-30 20:24:34 | INFO     | CYCLE #10
2025-11-30 20:24:34 | INFO     | ======================================================================
2025-11-30 20:24:34 | INFO     | Detected: 4 floating names
2025-11-30 20:24:34 | DEBUG    |   Name #1: Cached
2025-11-30 20:24:34 | DEBUG    |   Name #2: Cached
2025-11-30 20:24:34 | DEBUG    |   Name #3: Cached
2025-11-30 20:24:34 | DEBUG    |   Name #4: Cached
2025-11-30 20:24:34 | INFO     | → Valid targets: 0
2025-11-30 20:24:34 | INFO     | 
======================================================================
2025-11-30 20:24:34 | INFO     | CYCLE #11
2025-11-30 20:24:34 | INFO     | ======================================================================
2025-11-30 20:24:34 | INFO     | Detected: 5 floating names
2025-11-30 20:24:34 | DEBUG    |   Name #1: Cached
2025-11-30 20:24:34 | DEBUG    |   Name #2: Cached
2025-11-30 20:24:34 | DEBUG    |   Name #3: Cached
2025-11-30 20:24:34 | DEBUG    |   Name #4: Cached
2025-11-30 20:24:34 | DEBUG    |   Name #5: Player zone
2025-11-30 20:24:34 | INFO     | → Valid targets: 0
2025-11-30 20:24:35 | INFO     | 
======================================================================
2025-11-30 20:24:35 | INFO     | CYCLE #12
2025-11-30 20:24:35 | INFO     | ======================================================================
2025-11-30 20:24:35 | INFO     | Detected: 4 floating names
2025-11-30 20:24:35 | DEBUG    |   Region near center, might be player
2025-11-30 20:24:35 | DEBUG    |   Name #2: Player zone
2025-11-30 20:24:35 | DEBUG    |   Name #3: Player zone
2025-11-30 20:24:35 | DEBUG    |   Name #4: Player zone
2025-11-30 20:24:35 | INFO     | → Valid targets: 0
2025-11-30 20:24:35 | INFO     | 
======================================================================
2025-11-30 20:24:35 | INFO     | CYCLE #13
2025-11-30 20:24:35 | INFO     | ======================================================================
2025-11-30 20:24:35 | INFO     | Detected: 4 floating names
2025-11-30 20:24:35 | DEBUG    |   Name #1: Cached
2025-11-30 20:24:35 | DEBUG    |   Name #2: Cached
2025-11-30 20:24:35 | DEBUG    |   Name #3: Cached
2025-11-30 20:24:35 | DEBUG    |   Name #4: Cached
2025-11-30 20:24:35 | INFO     | → Valid targets: 0
2025-11-30 20:24:36 | INFO     | 
======================================================================
2025-11-30 20:24:36 | INFO     | CYCLE #14
2025-11-30 20:24:36 | INFO     | ======================================================================
2025-11-30 20:24:36 | INFO     | Detected: 4 floating names
2025-11-30 20:24:36 | DEBUG    |   Name #1: Cached
2025-11-30 20:24:36 | DEBUG    |   Name #2: Cached
2025-11-30 20:24:36 | DEBUG    |   Name #3: Cached
2025-11-30 20:24:36 | DEBUG    |   Name #4: Player zone
2025-11-30 20:24:36 | INFO     | → Valid targets: 0
2025-11-30 20:24:36 | INFO     | 
======================================================================
2025-11-30 20:24:36 | INFO     | CYCLE #15
2025-11-30 20:24:36 | INFO     | ======================================================================
2025-11-30 20:24:36 | INFO     | Detected: 4 floating names
2025-11-30 20:24:36 | DEBUG    |   Name #1: Cached
2025-11-30 20:24:36 | DEBUG    |   Name #2: Cached
2025-11-30 20:24:36 | DEBUG    |   Name #3: Cached
2025-11-30 20:24:36 | DEBUG    |   Name #4: Cached
2025-11-30 20:24:36 | INFO     | → Valid targets: 0
2025-11-30 20:24:37 | INFO     | 
======================================================================
2025-11-30 20:24:37 | INFO     | CYCLE #16
2025-11-30 20:24:37 | INFO     | ======================================================================
2025-11-30 20:24:37 | INFO     | Detected: 3 floating names
2025-11-30 20:24:37 | DEBUG    |   Name #1: Cached
2025-11-30 20:24:37 | DEBUG    |   Name #2: Cached
2025-11-30 20:24:37 | DEBUG    |   Name #3: Cached
2025-11-30 20:24:37 | INFO     | → Valid targets: 0
2025-11-30 20:24:37 | INFO     | 
======================================================================
2025-11-30 20:24:37 | INFO     | CYCLE #17
2025-11-30 20:24:37 | INFO     | ======================================================================
2025-11-30 20:24:37 | INFO     | Detected: 4 floating names
2025-11-30 20:24:37 | DEBUG    |   Name #1: Cached
2025-11-30 20:24:37 | DEBUG    |   Name #2: Cached
2025-11-30 20:24:37 | DEBUG    |   Name #3: Cached
2025-11-30 20:24:37 | DEBUG    |   Name #4: Cached
2025-11-30 20:24:37 | INFO     | → Valid targets: 0
2025-11-30 20:24:37 | INFO     | 
======================================================================
2025-11-30 20:24:37 | INFO     | CYCLE #18
2025-11-30 20:24:37 | INFO     | ======================================================================
2025-11-30 20:24:38 | INFO     | Detected: 3 floating names
2025-11-30 20:24:38 | DEBUG    |   Name #1: Player zone
2025-11-30 20:24:38 | DEBUG    |   Name #2: Player zone
2025-11-30 20:24:38 | DEBUG    |   Name #3: Player zone
2025-11-30 20:24:38 | INFO     | → Valid targets: 0
2025-11-30 20:24:38 | INFO     | 
======================================================================
2025-11-30 20:24:38 | INFO     | CYCLE #19
2025-11-30 20:24:38 | INFO     | ======================================================================
2025-11-30 20:24:38 | INFO     | Detected: 3 floating names
2025-11-30 20:24:38 | DEBUG    |   Name #1: Cached
2025-11-30 20:24:38 | DEBUG    |   Name #2: Cached
2025-11-30 20:24:38 | DEBUG    |   Name #3: Cached
2025-11-30 20:24:38 | INFO     | → Valid targets: 0
2025-11-30 20:24:38 | INFO     | 
======================================================================
2025-11-30 20:24:38 | INFO     | CYCLE #20
2025-11-30 20:24:38 | INFO     | ======================================================================
2025-11-30 20:24:38 | INFO     | Detected: 4 floating names
2025-11-30 20:24:38 | DEBUG    |   Name #1: Player zone
2025-11-30 20:24:38 | DEBUG    |   Name #2: Cached
2025-11-30 20:24:38 | DEBUG    |   Name #3: Cached
2025-11-30 20:24:38 | DEBUG    |   Name #4: Cached
2025-11-30 20:24:38 | INFO     | → Valid targets: 0
2025-11-30 20:24:39 | INFO     | 
======================================================================
2025-11-30 20:24:39 | INFO     | CYCLE #21
2025-11-30 20:24:39 | INFO     | ======================================================================
2025-11-30 20:24:39 | INFO     | Detected: 7 floating names
2025-11-30 20:24:39 | INFO     |   ✓ Target #1 at (398, 861)
2025-11-30 20:24:39 | DEBUG    |   Name #2: Cached
2025-11-30 20:24:39 | DEBUG    |   Name #3: Cached
2025-11-30 20:24:39 | DEBUG    |   Name #4: Cached
2025-11-30 20:24:39 | INFO     |   ✓ Target #5 at (668, 303)
2025-11-30 20:24:39 | INFO     |   ✓ Target #6 at (1030, 146)
2025-11-30 20:24:39 | DEBUG    |   Name #7: Cached
2025-11-30 20:24:39 | INFO     | → Valid targets: 3
2025-11-30 20:24:39 | INFO     | 
  Verifying #1...
2025-11-30 20:24:39 | DEBUG    |     Clicking (398, 892)
2025-11-30 20:24:39 | DEBUG    |     Nameplate read in 1 attempts
2025-11-30 20:24:39 | INFO     |     ✓ Elite | HP: 69%
2025-11-30 20:24:39 | INFO     | 
  Verifying #2...
2025-11-30 20:24:39 | DEBUG    |     Clicking (668, 334)
2025-11-30 20:24:40 | DEBUG    |     Nameplate read in 1 attempts
2025-11-30 20:24:40 | INFO     |     ✓ Elite | HP: 69%
2025-11-30 20:24:40 | INFO     | 
>>>>>>>>>>>>>>>>>>>>>>>>>>>>>>>>>>>>>>>>>>>>>>>>>>
2025-11-30 20:24:40 | INFO     | ENGAGING: Elite (HP: 69%)
2025-11-30 20:24:40 | INFO     | >>>>>>>>>>>>>>>>>>>>>>>>>>>>>>>>>>>>>>>>>>>>>>>>>>
2025-11-30 20:24:40 | INFO     |   Skill 1: 1
2025-11-30 20:24:40 | INFO     |   Skill 2: 2
2025-11-30 20:24:41 | INFO     |   Skill 3: 3
2025-11-30 20:24:42 | INFO     |   Skill 4: 4
2025-11-30 20:24:43 | INFO     | <<<<<<<<<<<<<<<<<<<<<<<<<<<<<<<<<<<<<<<<<<<<<<<<<<
2025-11-30 20:24:43 | INFO     | Total engagements: 4

2025-11-30 20:24:43 | INFO     | 
======================================================================
2025-11-30 20:24:43 | INFO     | CYCLE #22
2025-11-30 20:24:43 | INFO     | ======================================================================
2025-11-30 20:24:43 | INFO     | Detected: 9 floating names
2025-11-30 20:24:43 | DEBUG    |   Name #1: Player zone
2025-11-30 20:24:43 | DEBUG    |   Name #2: Cached
2025-11-30 20:24:43 | DEBUG    |   Name #3: Player zone
2025-11-30 20:24:43 | DEBUG    |   Region near center, might be player
2025-11-30 20:24:43 | INFO     |   ✓ Target #5 at (739, 358)
2025-11-30 20:24:43 | INFO     |   ✓ Target #6 at (712, 323)
2025-11-30 20:24:43 | DEBUG    |   Name #7: Cached
2025-11-30 20:24:43 | INFO     |   ✓ Target #8 at (1183, 182)
2025-11-30 20:24:43 | INFO     |   ✓ Target #9 at (1527, 175)
2025-11-30 20:24:43 | INFO     | → Valid targets: 4
2025-11-30 20:24:43 | INFO     | 
  Verifying #1...
2025-11-30 20:24:43 | DEBUG    |     Clicking (739, 389)
2025-11-30 20:24:43 | DEBUG    |     Nameplate read in 1 attempts
2025-11-30 20:24:43 | INFO     |     ✓ Elite | HP: 100%
2025-11-30 20:24:43 | INFO     | 
  Verifying #2...
2025-11-30 20:24:43 | DEBUG    |     Clicking (712, 354)
2025-11-30 20:24:44 | DEBUG    |     Nameplate read in 1 attempts
2025-11-30 20:24:44 | INFO     |     ✓ Elite | HP: 100%
2025-11-30 20:24:44 | INFO     | 
>>>>>>>>>>>>>>>>>>>>>>>>>>>>>>>>>>>>>>>>>>>>>>>>>>
2025-11-30 20:24:44 | INFO     | ENGAGING: Elite (HP: 100%)
2025-11-30 20:24:44 | INFO     | >>>>>>>>>>>>>>>>>>>>>>>>>>>>>>>>>>>>>>>>>>>>>>>>>>
2025-11-30 20:24:44 | INFO     |   Skill 1: 1
2025-11-30 20:24:44 | INFO     |   Skill 2: 2
2025-11-30 20:24:45 | INFO     |   Skill 3: 3
2025-11-30 20:24:46 | INFO     |   Skill 4: 4
2025-11-30 20:24:47 | INFO     | <<<<<<<<<<<<<<<<<<<<<<<<<<<<<<<<<<<<<<<<<<<<<<<<<<
2025-11-30 20:24:47 | INFO     | Total engagements: 5

2025-11-30 20:24:47 | INFO     | 
======================================================================
2025-11-30 20:24:47 | INFO     | CYCLE #23
2025-11-30 20:24:47 | INFO     | ======================================================================
2025-11-30 20:24:47 | INFO     | Detected: 7 floating names
2025-11-30 20:24:47 | DEBUG    |   Name #1: Player zone
2025-11-30 20:24:47 | DEBUG    |   Name #2: Cached
2025-11-30 20:24:47 | DEBUG    |   Name #3: Player zone
2025-11-30 20:24:47 | INFO     |   ✓ Target #4 at (1643, 336)
2025-11-30 20:24:47 | INFO     |   ✓ Target #5 at (1318, 207)
2025-11-30 20:24:47 | INFO     |   ✓ Target #6 at (979, 156)
2025-11-30 20:24:47 | DEBUG    |   Name #7: Player zone
2025-11-30 20:24:47 | INFO     | → Valid targets: 3
2025-11-30 20:24:47 | INFO     | 
  Verifying #1...
2025-11-30 20:24:47 | DEBUG    |     Clicking (1643, 367)
2025-11-30 20:24:47 | DEBUG    |     Nameplate read in 1 attempts
2025-11-30 20:24:47 | INFO     |     ✓ Elite | HP: 69%
2025-11-30 20:24:47 | INFO     | 
  Verifying #2...
2025-11-30 20:24:47 | DEBUG    |     Clicking (1318, 238)
2025-11-30 20:24:48 | DEBUG    |     Nameplate read in 1 attempts
2025-11-30 20:24:48 | INFO     |     ✓ Elite | HP: 69%
2025-11-30 20:24:48 | INFO     | 
>>>>>>>>>>>>>>>>>>>>>>>>>>>>>>>>>>>>>>>>>>>>>>>>>>
2025-11-30 20:24:48 | INFO     | ENGAGING: Elite (HP: 69%)
2025-11-30 20:24:48 | INFO     | >>>>>>>>>>>>>>>>>>>>>>>>>>>>>>>>>>>>>>>>>>>>>>>>>>
2025-11-30 20:24:48 | INFO     |   Skill 1: 1
2025-11-30 20:24:49 | INFO     |   Skill 2: 2
2025-11-30 20:24:49 | INFO     |   Skill 3: 3
2025-11-30 20:24:50 | INFO     |   Skill 4: 4
2025-11-30 20:24:51 | INFO     | <<<<<<<<<<<<<<<<<<<<<<<<<<<<<<<<<<<<<<<<<<<<<<<<<<
2025-11-30 20:24:51 | INFO     | Total engagements: 6

2025-11-30 20:24:51 | INFO     | 
======================================================================
2025-11-30 20:24:51 | INFO     | CYCLE #24
2025-11-30 20:24:51 | INFO     | ======================================================================
2025-11-30 20:24:51 | INFO     | Detected: 10 floating names
2025-11-30 20:24:51 | DEBUG    |   Name #1: Player zone
2025-11-30 20:24:51 | DEBUG    |   Region near center, might be player
2025-11-30 20:24:51 | DEBUG    |   Name #3: Player zone
2025-11-30 20:24:51 | DEBUG    |   Name #4: Cached
2025-11-30 20:24:51 | INFO     |   ✓ Target #5 at (1212, 342)
2025-11-30 20:24:51 | INFO     |   ✓ Target #6 at (744, 324)
2025-11-30 20:24:51 | INFO     |   ✓ Target #7 at (1132, 318)
2025-11-30 20:24:51 | DEBUG    |   Name #8: Cached
2025-11-30 20:24:51 | INFO     |   ✓ Target #9 at (866, 157)
2025-11-30 20:24:51 | INFO     |   ✓ Target #10 at (1026, 154)
2025-11-30 20:24:51 | INFO     | → Valid targets: 5
2025-11-30 20:24:51 | INFO     | 
  Verifying #1...
2025-11-30 20:24:51 | DEBUG    |     Clicking (1212, 373)
2025-11-30 20:24:51 | DEBUG    |     Nameplate read in 1 attempts
2025-11-30 20:24:51 | INFO     |     ✓ Elite | HP: 69%
2025-11-30 20:24:51 | INFO     | 
  Verifying #2...
2025-11-30 20:24:51 | DEBUG    |     Clicking (744, 355)
2025-11-30 20:24:52 | DEBUG    |     Nameplate read in 1 attempts
2025-11-30 20:24:52 | INFO     |     ✓ Elite | HP: 69%
2025-11-30 20:24:52 | INFO     | 
>>>>>>>>>>>>>>>>>>>>>>>>>>>>>>>>>>>>>>>>>>>>>>>>>>
2025-11-30 20:24:52 | INFO     | ENGAGING: Elite (HP: 69%)
2025-11-30 20:24:52 | INFO     | >>>>>>>>>>>>>>>>>>>>>>>>>>>>>>>>>>>>>>>>>>>>>>>>>>
2025-11-30 20:24:52 | INFO     |   Skill 1: 1
2025-11-30 20:24:53 | INFO     |   Skill 2: 2
2025-11-30 20:24:53 | INFO     |   Skill 3: 3
2025-11-30 20:24:54 | INFO     |   Skill 4: 4
2025-11-30 20:24:55 | INFO     | <<<<<<<<<<<<<<<<<<<<<<<<<<<<<<<<<<<<<<<<<<<<<<<<<<
2025-11-30 20:24:55 | INFO     | Total engagements: 7

2025-11-30 20:24:55 | INFO     | 
======================================================================
2025-11-30 20:24:55 | INFO     | CYCLE #25
2025-11-30 20:24:55 | INFO     | ======================================================================
2025-11-30 20:24:55 | INFO     | Detected: 10 floating names
2025-11-30 20:24:55 | DEBUG    |   Name #1: Player zone
2025-11-30 20:24:55 | DEBUG    |   Region near center, might be player
2025-11-30 20:24:55 | DEBUG    |   Name #3: Player zone
2025-11-30 20:24:55 | DEBUG    |   Name #4: Cached
2025-11-30 20:24:55 | INFO     |   ✓ Target #5 at (722, 353)
2025-11-30 20:24:55 | INFO     |   ✓ Target #6 at (1266, 344)
2025-11-30 20:24:55 | INFO     |   ✓ Target #7 at (1209, 306)
2025-11-30 20:24:55 | DEBUG    |   Name #8: Cached
2025-11-30 20:24:55 | INFO     |   ✓ Target #9 at (848, 158)
2025-11-30 20:24:55 | INFO     |   ✓ Target #10 at (1003, 156)
2025-11-30 20:24:55 | INFO     | → Valid targets: 5
2025-11-30 20:24:55 | INFO     | 
  Verifying #1...
2025-11-30 20:24:55 | DEBUG    |     Clicking (722, 384)
2025-11-30 20:24:55 | DEBUG    |     Nameplate read in 1 attempts
2025-11-30 20:24:55 | INFO     |     ✓ Elite | HP: 3%
2025-11-30 20:24:55 | INFO     | 
  Verifying #2...
2025-11-30 20:24:55 | DEBUG    |     Clicking (1266, 375)
2025-11-30 20:24:56 | DEBUG    |     Nameplate read in 1 attempts
2025-11-30 20:24:56 | INFO     |     ✓ Elite | HP: 3%
2025-11-30 20:24:56 | INFO     | 
======================================================================
2025-11-30 20:24:56 | INFO     | CYCLE #26
2025-11-30 20:24:56 | INFO     | ======================================================================
2025-11-30 20:24:56 | INFO     | Detected: 11 floating names
2025-11-30 20:24:56 | DEBUG    |   Name #1: Player zone
2025-11-30 20:24:56 | DEBUG    |   Name #2: Cached
2025-11-30 20:24:56 | DEBUG    |   Region near center, might be player
2025-11-30 20:24:56 | DEBUG    |   Name #4: Player zone
2025-11-30 20:24:56 | DEBUG    |   Name #5: Cached
2025-11-30 20:24:56 | DEBUG    |   Name #6: Cached
2025-11-30 20:24:56 | DEBUG    |   Name #7: Cached
2025-11-30 20:24:56 | DEBUG    |   Region near center, might be player
2025-11-30 20:24:56 | DEBUG    |   Name #9: Player zone
2025-11-30 20:24:56 | INFO     |   ✓ Target #10 at (870, 231)
2025-11-30 20:24:56 | INFO     |   ✓ Target #11 at (711, 221)
2025-11-30 20:24:56 | INFO     | → Valid targets: 2
2025-11-30 20:24:56 | INFO     | 
  Verifying #1...
2025-11-30 20:24:56 | DEBUG    |     Clicking (870, 262)
2025-11-30 20:24:57 | DEBUG    |     Nameplate read in 1 attempts
2025-11-30 20:24:57 | INFO     |     ✓ Elite | HP: 3%
2025-11-30 20:24:57 | INFO     | 
  Verifying #2...
2025-11-30 20:24:57 | DEBUG    |     Clicking (711, 252)
2025-11-30 20:24:57 | DEBUG    |     Nameplate read in 1 attempts
2025-11-30 20:24:57 | INFO     |     ✓ Elite | HP: 69%
2025-11-30 20:24:58 | INFO     | 
======================================================================
2025-11-30 20:24:58 | INFO     | CYCLE #27
2025-11-30 20:24:58 | INFO     | ======================================================================
2025-11-30 20:24:58 | INFO     | Detected: 7 floating names
2025-11-30 20:24:58 | INFO     |   ✓ Target #1 at (527, 740)
2025-11-30 20:24:58 | DEBUG    |   Name #2: Player zone
2025-11-30 20:24:58 | DEBUG    |   Name #3: Cached
2025-11-30 20:24:58 | DEBUG    |   Region near center, might be player
2025-11-30 20:24:58 | DEBUG    |   Region near center, might be player
2025-11-30 20:24:58 | DEBUG    |   Region near center, might be player
2025-11-30 20:24:58 | INFO     |   ✓ Target #7 at (703, 384)
2025-11-30 20:24:58 | INFO     | → Valid targets: 2
2025-11-30 20:24:58 | INFO     | 
  Verifying #1...
2025-11-30 20:24:58 | DEBUG    |     Clicking (527, 771)
2025-11-30 20:24:58 | DEBUG    |     Nameplate read in 1 attempts
2025-11-30 20:24:58 | INFO     |     ✓ Elite | HP: 69%
2025-11-30 20:24:58 | INFO     | 
  Verifying #2...
2025-11-30 20:24:58 | DEBUG    |     Clicking (703, 415)
2025-11-30 20:24:58 | DEBUG    |     Nameplate read in 1 attempts
2025-11-30 20:24:58 | INFO     |     ✓ Elite | HP: 69%
2025-11-30 20:24:58 | INFO     | 
>>>>>>>>>>>>>>>>>>>>>>>>>>>>>>>>>>>>>>>>>>>>>>>>>>
2025-11-30 20:24:58 | INFO     | ENGAGING: Elite (HP: 69%)
2025-11-30 20:24:58 | INFO     | >>>>>>>>>>>>>>>>>>>>>>>>>>>>>>>>>>>>>>>>>>>>>>>>>>
2025-11-30 20:24:58 | INFO     |   Skill 1: 1
2025-11-30 20:24:59 | INFO     |   Skill 2: 2
2025-11-30 20:25:00 | INFO     |   Skill 3: 3
2025-11-30 20:25:00 | INFO     |   Skill 4: 4
2025-11-30 20:25:01 | INFO     | <<<<<<<<<<<<<<<<<<<<<<<<<<<<<<<<<<<<<<<<<<<<<<<<<<
2025-11-30 20:25:01 | INFO     | Total engagements: 8

2025-11-30 20:25:02 | INFO     | 
======================================================================
2025-11-30 20:25:02 | INFO     | CYCLE #28
2025-11-30 20:25:02 | INFO     | ======================================================================
2025-11-30 20:25:02 | INFO     | Detected: 8 floating names
2025-11-30 20:25:02 | DEBUG    |   Region near center, might be player
2025-11-30 20:25:02 | DEBUG    |   Name #2: Player zone
2025-11-30 20:25:02 | DEBUG    |   Name #3: Player zone
2025-11-30 20:25:02 | DEBUG    |   Name #4: Cached
2025-11-30 20:25:02 | DEBUG    |   Name #5: Cached
2025-11-30 20:25:02 | DEBUG    |   Name #6: Player zone
2025-11-30 20:25:02 | DEBUG    |   Name #7: Player zone
2025-11-30 20:25:02 | INFO     |   ✓ Target #8 at (1428, 299)
2025-11-30 20:25:02 | INFO     | → Valid targets: 1
2025-11-30 20:25:02 | INFO     | 
  Verifying #1...
2025-11-30 20:25:02 | DEBUG    |     Clicking (1428, 330)
2025-11-30 20:25:02 | DEBUG    |     Nameplate read in 1 attempts
2025-11-30 20:25:02 | INFO     |     ✓ Elite | HP: 69%
2025-11-30 20:25:02 | INFO     | 
>>>>>>>>>>>>>>>>>>>>>>>>>>>>>>>>>>>>>>>>>>>>>>>>>>
2025-11-30 20:25:02 | INFO     | ENGAGING: Elite (HP: 69%)
2025-11-30 20:25:02 | INFO     | >>>>>>>>>>>>>>>>>>>>>>>>>>>>>>>>>>>>>>>>>>>>>>>>>>
2025-11-30 20:25:02 | INFO     |   Skill 1: 1
2025-11-30 20:25:03 | INFO     | 

⛔ Bot stopped by user
2025-11-30 20:25:03 | INFO     | 
======================================================================
2025-11-30 20:25:03 | INFO     | FINAL STATISTICS
2025-11-30 20:25:03 | INFO     | ======================================================================
2025-11-30 20:25:03 | INFO     | Total Cycles: 28
2025-11-30 20:25:03 | INFO     | Total Clicks: 23
2025-11-30 20:25:03 | INFO     | Total Engagements: 8
2025-11-30 20:25:03 | INFO     | Uptime: 44s (0m 44s)
2025-11-30 20:25:03 | INFO     | Cache Hit Rate: 45.0%
2025-11-30 20:25:03 | INFO     | Avg Cycle Time: 1.57s
2025-11-30 20:25:03 | INFO     | ======================================================================
