2025-12-02 20:34:21 | INFO     | ======================================================================
2025-12-02 20:34:21 | INFO     | MOB HUNTER v3.0 - FULL VERSION
2025-12-02 20:34:21 | INFO     | ======================================================================
2025-12-02 20:34:21 | INFO     | Log directory: logs/session_20251202_203421
2025-12-02 20:34:21 | INFO     | Screen: 1920x1080
2025-12-02 20:34:21 | INFO     | Overlay: ENABLED
2025-12-02 20:34:21 | INFO     | ======================================================================
2025-12-02 20:34:21 | INFO     | 
🚀 Bot initialized! Press CapsLock to start, Ctrl+C to stop.

2025-12-02 20:34:26 | INFO     | 
▶ RUNNING - Press CapsLock to pause
2025-12-02 20:34:26 | INFO     | 
======================================================================
2025-12-02 20:34:26 | INFO     | CYCLE #1
2025-12-02 20:34:26 | INFO     | ======================================================================
2025-12-02 20:34:26 | INFO     | Detected: 11 floating names
2025-12-02 20:34:26 | INFO     |   ✓ Target #1 at (1379, 805)
2025-12-02 20:34:26 | DEBUG    |   Name #2: Player zone
2025-12-02 20:34:26 | DEBUG    |   Name #3: Player zone
2025-12-02 20:34:26 | INFO     |   ✓ Target #4 at (257, 326)
2025-12-02 20:34:26 | INFO     |   ✓ Target #5 at (961, 325)
2025-12-02 20:34:26 | INFO     |   ✓ Target #6 at (773, 264)
2025-12-02 20:34:26 | INFO     |   ✓ Target #7 at (1159, 132)
2025-12-02 20:34:26 | DEBUG    |   Name #8: Cached
2025-12-02 20:34:26 | DEBUG    |   Name #9: Cached
2025-12-02 20:34:26 | DEBUG    |   Name #10: Player zone
2025-12-02 20:34:26 | INFO     |   ✓ Target #11 at (222, 346)
2025-12-02 20:34:26 | INFO     | → Valid targets: 6
2025-12-02 20:34:26 | INFO     | 
  Verifying #1...
2025-12-02 20:34:26 | DEBUG    |     Clicking (1379, 835)
2025-12-02 20:34:26 | DEBUG    |     Nameplate read in 1 attempts
2025-12-02 20:34:26 | INFO     |     ✓ Elite | HP: 69%
2025-12-02 20:34:26 | INFO     | 
  Verifying #2...
2025-12-02 20:34:26 | DEBUG    |     Clicking (257, 356)
2025-12-02 20:34:27 | DEBUG    |     Nameplate read in 1 attempts
2025-12-02 20:34:27 | INFO     |     ✓ Elite | HP: 69%
2025-12-02 20:34:27 | INFO     | 
>>>>>>>>>>>>>>>>>>>>>>>>>>>>>>>>>>>>>>>>>>>>>>>>>>
2025-12-02 20:34:27 | INFO     | ENGAGING: Elite (HP: 69%)
2025-12-02 20:34:27 | INFO     | >>>>>>>>>>>>>>>>>>>>>>>>>>>>>>>>>>>>>>>>>>>>>>>>>>
2025-12-02 20:34:27 | INFO     |   Skill 1: 1
2025-12-02 20:34:27 | INFO     |   Skill 2: 2
2025-12-02 20:34:28 | INFO     |   Skill 3: 3
2025-12-02 20:34:29 | INFO     |   Skill 4: 4
2025-12-02 20:34:29 | INFO     | <<<<<<<<<<<<<<<<<<<<<<<<<<<<<<<<<<<<<<<<<<<<<<<<<<
2025-12-02 20:34:29 | INFO     | Total engagements: 1

2025-12-02 20:34:30 | INFO     | 
======================================================================
2025-12-02 20:34:30 | INFO     | CYCLE #2
2025-12-02 20:34:30 | INFO     | ======================================================================
2025-12-02 20:34:30 | INFO     | Detected: 13 floating names
2025-12-02 20:34:30 | DEBUG    |   Name #1: Player zone
2025-12-02 20:34:30 | DEBUG    |   Region near center, might be player
2025-12-02 20:34:30 | DEBUG    |   Name #3: Player zone
2025-12-02 20:34:30 | DEBUG    |   Region near center, might be player
2025-12-02 20:34:30 | DEBUG    |   Region near center, might be player
2025-12-02 20:34:30 | DEBUG    |   Name #6: Cached
2025-12-02 20:34:30 | DEBUG    |   Region near center, might be player
2025-12-02 20:34:30 | DEBUG    |   Region near center, might be player
2025-12-02 20:34:30 | INFO     |   ✓ Target #9 at (867, 318)
2025-12-02 20:34:30 | INFO     |   ✓ Target #10 at (1338, 170)
2025-12-02 20:34:30 | DEBUG    |   Name #11: Cached
2025-12-02 20:34:30 | DEBUG    |   Region near center, might be player
2025-12-02 20:34:30 | DEBUG    |   Name #13: Cached
2025-12-02 20:34:30 | INFO     | → Valid targets: 2
2025-12-02 20:34:30 | INFO     | 
  Verifying #1...
2025-12-02 20:34:30 | DEBUG    |     Clicking (867, 348)
2025-12-02 20:34:30 | DEBUG    |     Nameplate read in 1 attempts
2025-12-02 20:34:30 | INFO     |     ✓ Elite | HP: 69%
2025-12-02 20:34:30 | INFO     | 
  Verifying #2...
2025-12-02 20:34:30 | DEBUG    |     Clicking (1338, 200)
2025-12-02 20:34:31 | DEBUG    |     Nameplate read in 1 attempts
2025-12-02 20:34:31 | INFO     |     ✓ Elite | HP: 69%
2025-12-02 20:34:31 | INFO     | 
>>>>>>>>>>>>>>>>>>>>>>>>>>>>>>>>>>>>>>>>>>>>>>>>>>
2025-12-02 20:34:31 | INFO     | ENGAGING: Elite (HP: 69%)
2025-12-02 20:34:31 | INFO     | >>>>>>>>>>>>>>>>>>>>>>>>>>>>>>>>>>>>>>>>>>>>>>>>>>
2025-12-02 20:34:31 | INFO     |   Skill 1: 1
2025-12-02 20:34:31 | INFO     |   Skill 2: 2
2025-12-02 20:34:32 | INFO     |   Skill 3: 3
2025-12-02 20:34:33 | INFO     |   Skill 4: 4
2025-12-02 20:34:34 | INFO     | <<<<<<<<<<<<<<<<<<<<<<<<<<<<<<<<<<<<<<<<<<<<<<<<<<
2025-12-02 20:34:34 | INFO     | Total engagements: 2

2025-12-02 20:34:34 | INFO     | 
======================================================================
2025-12-02 20:34:34 | INFO     | CYCLE #3
2025-12-02 20:34:34 | INFO     | ======================================================================
2025-12-02 20:34:34 | INFO     | Detected: 18 floating names
2025-12-02 20:34:34 | INFO     |   ✓ Target #1 at (702, 791)
2025-12-02 20:34:34 | DEBUG    |   Region near center, might be player
2025-12-02 20:34:34 | DEBUG    |   Name #3: Player zone
2025-12-02 20:34:34 | DEBUG    |   Name #4: Player zone
2025-12-02 20:34:34 | INFO     |   ✓ Target #5 at (1131, 319)
2025-12-02 20:34:34 | INFO     |   ✓ Target #6 at (985, 222)
2025-12-02 20:34:34 | INFO     |   ✓ Target #7 at (969, 183)
2025-12-02 20:34:34 | INFO     |   ✓ Target #8 at (934, 183)
2025-12-02 20:34:34 | INFO     |   ✓ Target #9 at (1031, 162)
2025-12-02 20:34:34 | DEBUG    |   Name #10: Cached
2025-12-02 20:34:34 | DEBUG    |   Name #11: Cached
2025-12-02 20:34:34 | DEBUG    |   Name #12: Cached
2025-12-02 20:34:34 | DEBUG    |   Name #13: Cached
2025-12-02 20:34:34 | DEBUG    |   Name #14: Cached
2025-12-02 20:34:34 | INFO     |   ✓ Target #15 at (999, 132)
2025-12-02 20:34:34 | DEBUG    |   Name #16: Cached
2025-12-02 20:34:34 | DEBUG    |   Name #17: Player zone
2025-12-02 20:34:34 | INFO     |   ✓ Target #18 at (1095, 339)
2025-12-02 20:34:34 | INFO     | → Valid targets: 8
2025-12-02 20:34:34 | INFO     | 
  Verifying #1...
2025-12-02 20:34:34 | DEBUG    |     Clicking (702, 821)
2025-12-02 20:34:34 | DEBUG    |     Nameplate read in 1 attempts
2025-12-02 20:34:34 | INFO     |     ✓ Elite | HP: 100%
2025-12-02 20:34:34 | INFO     | 
  Verifying #2...
2025-12-02 20:34:34 | DEBUG    |     Clicking (1131, 349)
2025-12-02 20:34:35 | DEBUG    |     Nameplate read in 1 attempts
2025-12-02 20:34:35 | INFO     |     ✓ Elite | HP: 69%
2025-12-02 20:34:35 | INFO     | 
>>>>>>>>>>>>>>>>>>>>>>>>>>>>>>>>>>>>>>>>>>>>>>>>>>
2025-12-02 20:34:35 | INFO     | ENGAGING: Elite (HP: 100%)
2025-12-02 20:34:35 | INFO     | >>>>>>>>>>>>>>>>>>>>>>>>>>>>>>>>>>>>>>>>>>>>>>>>>>
2025-12-02 20:34:35 | INFO     |   Skill 1: 1
2025-12-02 20:34:35 | INFO     |   Skill 2: 2
2025-12-02 20:34:36 | INFO     |   Skill 3: 3
2025-12-02 20:34:37 | INFO     |   Skill 4: 4
2025-12-02 20:34:38 | INFO     | <<<<<<<<<<<<<<<<<<<<<<<<<<<<<<<<<<<<<<<<<<<<<<<<<<
2025-12-02 20:34:38 | INFO     | Total engagements: 3

2025-12-02 20:34:38 | INFO     | 
======================================================================
2025-12-02 20:34:38 | INFO     | CYCLE #4
2025-12-02 20:34:38 | INFO     | ======================================================================
2025-12-02 20:34:38 | INFO     | Detected: 9 floating names
2025-12-02 20:34:38 | DEBUG    |   Name #1: Player zone
2025-12-02 20:34:38 | DEBUG    |   Region near center, might be player
2025-12-02 20:34:38 | DEBUG    |   Name #3: Player zone
2025-12-02 20:34:38 | INFO     |   ✓ Target #4 at (1122, 368)
2025-12-02 20:34:38 | INFO     |   ✓ Target #5 at (1023, 332)
2025-12-02 20:34:38 | INFO     |   ✓ Target #6 at (982, 239)
2025-12-02 20:34:38 | DEBUG    |   Name #7: Cached
2025-12-02 20:34:38 | DEBUG    |   Name #8: Cached
2025-12-02 20:34:38 | INFO     |   ✓ Target #9 at (976, 348)
2025-12-02 20:34:38 | INFO     | → Valid targets: 4
2025-12-02 20:34:38 | INFO     | 
  Verifying #1...
2025-12-02 20:34:38 | DEBUG    |     Clicking (1122, 398)
2025-12-02 20:34:38 | DEBUG    |     Nameplate read in 1 attempts
2025-12-02 20:34:38 | INFO     |     ✓ Elite | HP: 1%
2025-12-02 20:34:38 | INFO     | 
  Verifying #2...
2025-12-02 20:34:38 | DEBUG    |     Clicking (1023, 362)
2025-12-02 20:34:39 | DEBUG    |     Nameplate read in 1 attempts
2025-12-02 20:34:39 | INFO     |     ✓ Elite | HP: 100%
2025-12-02 20:34:39 | INFO     | 
======================================================================
2025-12-02 20:34:39 | INFO     | CYCLE #5
2025-12-02 20:34:39 | INFO     | ======================================================================
2025-12-02 20:34:39 | INFO     | Detected: 7 floating names
2025-12-02 20:34:39 | DEBUG    |   Name #1: Player zone
2025-12-02 20:34:39 | DEBUG    |   Name #2: Cached
2025-12-02 20:34:39 | DEBUG    |   Name #3: Cached
2025-12-02 20:34:39 | DEBUG    |   Region near center, might be player
2025-12-02 20:34:39 | DEBUG    |   Name #5: Cached
2025-12-02 20:34:39 | DEBUG    |   Name #6: Player zone
2025-12-02 20:34:39 | DEBUG    |   Name #7: Player zone
2025-12-02 20:34:39 | INFO     | → Valid targets: 0
2025-12-02 20:34:40 | INFO     | 
======================================================================
2025-12-02 20:34:40 | INFO     | CYCLE #6
2025-12-02 20:34:40 | INFO     | ======================================================================
2025-12-02 20:34:40 | INFO     | Detected: 7 floating names
2025-12-02 20:34:40 | INFO     |   ✓ Target #1 at (990, 813)
2025-12-02 20:34:40 | INFO     |   ✓ Target #2 at (1090, 695)
2025-12-02 20:34:40 | DEBUG    |   Name #3: Cached
2025-12-02 20:34:40 | DEBUG    |   Name #4: Cached
2025-12-02 20:34:40 | DEBUG    |   Name #5: Cached
2025-12-02 20:34:40 | DEBUG    |   Name #6: Cached
2025-12-02 20:34:40 | DEBUG    |   Name #7: Cached
2025-12-02 20:34:40 | INFO     | → Valid targets: 2
2025-12-02 20:34:40 | INFO     | 
  Verifying #1...
2025-12-02 20:34:40 | DEBUG    |     Clicking (990, 843)
2025-12-02 20:34:40 | DEBUG    |     Nameplate read in 1 attempts
2025-12-02 20:34:40 | INFO     |     ✓ Elite | HP: 100%
2025-12-02 20:34:40 | INFO     | 
  Verifying #2...
2025-12-02 20:34:40 | DEBUG    |     Clicking (1090, 725)
2025-12-02 20:34:41 | DEBUG    |     Nameplate read in 1 attempts
2025-12-02 20:34:41 | INFO     |     ✓ Elite | HP: 100%
2025-12-02 20:34:41 | INFO     | 
>>>>>>>>>>>>>>>>>>>>>>>>>>>>>>>>>>>>>>>>>>>>>>>>>>
2025-12-02 20:34:41 | INFO     | ENGAGING: Elite (HP: 100%)
2025-12-02 20:34:41 | INFO     | >>>>>>>>>>>>>>>>>>>>>>>>>>>>>>>>>>>>>>>>>>>>>>>>>>
2025-12-02 20:34:41 | INFO     |   Skill 1: 1
2025-12-02 20:34:41 | INFO     |   Skill 2: 2
2025-12-02 20:34:42 | INFO     |   Skill 3: 3
2025-12-02 20:34:43 | INFO     |   Skill 4: 4
2025-12-02 20:34:43 | INFO     | <<<<<<<<<<<<<<<<<<<<<<<<<<<<<<<<<<<<<<<<<<<<<<<<<<
2025-12-02 20:34:43 | INFO     | Total engagements: 4

2025-12-02 20:34:44 | INFO     | 
======================================================================
2025-12-02 20:34:44 | INFO     | CYCLE #7
2025-12-02 20:34:44 | INFO     | ======================================================================
2025-12-02 20:34:44 | INFO     | Detected: 8 floating names
2025-12-02 20:34:44 | INFO     |   ✓ Target #1 at (1085, 745)
2025-12-02 20:34:44 | INFO     |   ✓ Target #2 at (1090, 695)
2025-12-02 20:34:44 | DEBUG    |   Name #3: Player zone
2025-12-02 20:34:44 | DEBUG    |   Name #4: Player zone
2025-12-02 20:34:44 | DEBUG    |   Name #5: Player zone
2025-12-02 20:34:44 | DEBUG    |   Name #6: Cached
2025-12-02 20:34:44 | DEBUG    |   Name #7: Cached
2025-12-02 20:34:44 | DEBUG    |   Name #8: Player zone
2025-12-02 20:34:44 | INFO     | → Valid targets: 2
2025-12-02 20:34:44 | INFO     | 
  Verifying #1...
2025-12-02 20:34:44 | DEBUG    |     Clicking (1085, 776)
2025-12-02 20:34:44 | DEBUG    |     Nameplate read in 1 attempts
2025-12-02 20:34:44 | INFO     |     ✓ Elite | HP: 100%
2025-12-02 20:34:44 | INFO     | 
  Verifying #2...
2025-12-02 20:34:44 | DEBUG    |     Clicking (1090, 725)
2025-12-02 20:34:45 | DEBUG    |     Nameplate read in 1 attempts
2025-12-02 20:34:45 | INFO     |     ✓ Elite | HP: 100%
2025-12-02 20:34:45 | INFO     | 
>>>>>>>>>>>>>>>>>>>>>>>>>>>>>>>>>>>>>>>>>>>>>>>>>>
2025-12-02 20:34:45 | INFO     | ENGAGING: Elite (HP: 100%)
2025-12-02 20:34:45 | INFO     | >>>>>>>>>>>>>>>>>>>>>>>>>>>>>>>>>>>>>>>>>>>>>>>>>>
2025-12-02 20:34:45 | INFO     |   Skill 1: 1
2025-12-02 20:34:45 | INFO     |   Skill 2: 2
2025-12-02 20:34:46 | INFO     |   Skill 3: 3
2025-12-02 20:34:47 | INFO     |   Skill 4: 4
2025-12-02 20:34:47 | INFO     | <<<<<<<<<<<<<<<<<<<<<<<<<<<<<<<<<<<<<<<<<<<<<<<<<<
2025-12-02 20:34:47 | INFO     | Total engagements: 5

2025-12-02 20:34:48 | INFO     | 
======================================================================
2025-12-02 20:34:48 | INFO     | CYCLE #8
2025-12-02 20:34:48 | INFO     | ======================================================================
2025-12-02 20:34:48 | INFO     | Detected: 8 floating names
2025-12-02 20:34:48 | INFO     |   ✓ Target #1 at (1084, 744)
2025-12-02 20:34:48 | INFO     |   ✓ Target #2 at (1090, 695)
2025-12-02 20:34:48 | DEBUG    |   Name #3: Player zone
2025-12-02 20:34:48 | DEBUG    |   Region near center, might be player
2025-12-02 20:34:48 | DEBUG    |   Name #5: Player zone
2025-12-02 20:34:48 | DEBUG    |   Name #6: Cached
2025-12-02 20:34:48 | DEBUG    |   Name #7: Cached
2025-12-02 20:34:48 | DEBUG    |   Region near center, might be player
2025-12-02 20:34:48 | INFO     | → Valid targets: 2
2025-12-02 20:34:48 | INFO     | 
  Verifying #1...
2025-12-02 20:34:48 | DEBUG    |     Clicking (1084, 776)
2025-12-02 20:34:48 | DEBUG    |     Nameplate read in 1 attempts
2025-12-02 20:34:48 | INFO     |     ✓ Elite | HP: 100%
2025-12-02 20:34:48 | INFO     | 
  Verifying #2...
2025-12-02 20:34:48 | DEBUG    |     Clicking (1090, 725)
2025-12-02 20:34:49 | DEBUG    |     Nameplate read in 1 attempts
2025-12-02 20:34:49 | INFO     |     ✓ Elite | HP: 100%
2025-12-02 20:34:49 | INFO     | 
>>>>>>>>>>>>>>>>>>>>>>>>>>>>>>>>>>>>>>>>>>>>>>>>>>
2025-12-02 20:34:49 | INFO     | ENGAGING: Elite (HP: 100%)
2025-12-02 20:34:49 | INFO     | >>>>>>>>>>>>>>>>>>>>>>>>>>>>>>>>>>>>>>>>>>>>>>>>>>
2025-12-02 20:34:49 | INFO     |   Skill 1: 1
2025-12-02 20:34:49 | INFO     |   Skill 2: 2
2025-12-02 20:34:50 | INFO     |   Skill 3: 3
2025-12-02 20:34:51 | INFO     |   Skill 4: 4
2025-12-02 20:34:51 | INFO     | <<<<<<<<<<<<<<<<<<<<<<<<<<<<<<<<<<<<<<<<<<<<<<<<<<
2025-12-02 20:34:51 | INFO     | Total engagements: 6

2025-12-02 20:34:52 | INFO     | 
======================================================================
2025-12-02 20:34:52 | INFO     | CYCLE #9
2025-12-02 20:34:52 | INFO     | ======================================================================
2025-12-02 20:34:52 | INFO     | Detected: 10 floating names
2025-12-02 20:34:52 | INFO     |   ✓ Target #1 at (353, 717)
2025-12-02 20:34:52 | INFO     |   ✓ Target #2 at (1090, 695)
2025-12-02 20:34:52 | DEBUG    |   Name #3: Player zone
2025-12-02 20:34:52 | DEBUG    |   Name #4: Player zone
2025-12-02 20:34:52 | INFO     |   ✓ Target #5 at (816, 141)
2025-12-02 20:34:52 | INFO     |   ✓ Target #6 at (281, 781)
2025-12-02 20:34:52 | INFO     |   ✓ Target #7 at (310, 759)
2025-12-02 20:34:52 | DEBUG    |   Name #8: Cached
2025-12-02 20:34:52 | DEBUG    |   Name #9: Cached
2025-12-02 20:34:52 | INFO     |   ✓ Target #10 at (364, 759)
2025-12-02 20:34:52 | INFO     | → Valid targets: 6
2025-12-02 20:34:52 | INFO     | 
  Verifying #1...
2025-12-02 20:34:52 | DEBUG    |     Clicking (353, 747)
2025-12-02 20:34:52 | DEBUG    |     Nameplate read in 1 attempts
2025-12-02 20:34:52 | INFO     |     ✓ Elite | HP: 69%
2025-12-02 20:34:52 | INFO     | 
  Verifying #2...
2025-12-02 20:34:52 | DEBUG    |     Clicking (1090, 725)
2025-12-02 20:34:53 | DEBUG    |     Nameplate read in 1 attempts
2025-12-02 20:34:53 | INFO     |     ✓ Elite | HP: 100%
2025-12-02 20:34:53 | INFO     | 
>>>>>>>>>>>>>>>>>>>>>>>>>>>>>>>>>>>>>>>>>>>>>>>>>>
2025-12-02 20:34:53 | INFO     | ENGAGING: Elite (HP: 69%)
2025-12-02 20:34:53 | INFO     | >>>>>>>>>>>>>>>>>>>>>>>>>>>>>>>>>>>>>>>>>>>>>>>>>>
2025-12-02 20:34:53 | INFO     |   Skill 1: 1
2025-12-02 20:34:53 | INFO     |   Skill 2: 2
2025-12-02 20:34:54 | INFO     |   Skill 3: 3
2025-12-02 20:34:55 | INFO     |   Skill 4: 4
2025-12-02 20:34:56 | INFO     | <<<<<<<<<<<<<<<<<<<<<<<<<<<<<<<<<<<<<<<<<<<<<<<<<<
2025-12-02 20:34:56 | INFO     | Total engagements: 7

2025-12-02 20:34:56 | INFO     | 
======================================================================
2025-12-02 20:34:56 | INFO     | CYCLE #10
2025-12-02 20:34:56 | INFO     | ======================================================================
2025-12-02 20:34:56 | INFO     | Detected: 10 floating names
2025-12-02 20:34:56 | DEBUG    |   Name #1: Player zone
2025-12-02 20:34:56 | DEBUG    |   Name #2: Player zone
2025-12-02 20:34:56 | DEBUG    |   Region near center, might be player
2025-12-02 20:34:56 | DEBUG    |   Region near center, might be player
2025-12-02 20:34:56 | INFO     |   ✓ Target #5 at (796, 276)
2025-12-02 20:34:56 | INFO     |   ✓ Target #6 at (1004, 262)
2025-12-02 20:34:56 | INFO     |   ✓ Target #7 at (752, 201)
2025-12-02 20:34:56 | DEBUG    |   Name #8: Cached
2025-12-02 20:34:56 | DEBUG    |   Name #9: Cached
2025-12-02 20:34:56 | DEBUG    |   Region near center, might be player
2025-12-02 20:34:56 | INFO     | → Valid targets: 3
2025-12-02 20:34:56 | INFO     | 
  Verifying #1...
2025-12-02 20:34:56 | DEBUG    |     Clicking (796, 306)
2025-12-02 20:34:56 | DEBUG    |     Nameplate read in 1 attempts
2025-12-02 20:34:56 | INFO     |     ✓ Elite | HP: 69%
2025-12-02 20:34:56 | INFO     | 
  Verifying #2...
2025-12-02 20:34:56 | DEBUG    |     Clicking (1004, 292)
2025-12-02 20:34:57 | DEBUG    |     Nameplate read in 1 attempts
2025-12-02 20:34:57 | INFO     |     ✓ Elite | HP: 69%
2025-12-02 20:34:57 | INFO     | 
>>>>>>>>>>>>>>>>>>>>>>>>>>>>>>>>>>>>>>>>>>>>>>>>>>
2025-12-02 20:34:57 | INFO     | ENGAGING: Elite (HP: 69%)
2025-12-02 20:34:57 | INFO     | >>>>>>>>>>>>>>>>>>>>>>>>>>>>>>>>>>>>>>>>>>>>>>>>>>
2025-12-02 20:34:57 | INFO     |   Skill 1: 1
2025-12-02 20:34:57 | INFO     |   Skill 2: 2
2025-12-02 20:34:58 | INFO     |   Skill 3: 3
2025-12-02 20:34:59 | INFO     |   Skill 4: 4
2025-12-02 20:35:00 | INFO     | <<<<<<<<<<<<<<<<<<<<<<<<<<<<<<<<<<<<<<<<<<<<<<<<<<
2025-12-02 20:35:00 | INFO     | Total engagements: 8

2025-12-02 20:35:00 | INFO     | 
======================================================================
2025-12-02 20:35:00 | INFO     | CYCLE #11
2025-12-02 20:35:00 | INFO     | ======================================================================
2025-12-02 20:35:00 | INFO     | Detected: 17 floating names
2025-12-02 20:35:00 | INFO     |   ✓ Target #1 at (413, 835)
2025-12-02 20:35:00 | DEBUG    |   Region near center, might be player
2025-12-02 20:35:00 | DEBUG    |   Name #3: Player zone
2025-12-02 20:35:00 | DEBUG    |   Name #4: Player zone
2025-12-02 20:35:00 | DEBUG    |   Name #5: Player zone
2025-12-02 20:35:00 | DEBUG    |   Name #6: Player zone
2025-12-02 20:35:00 | DEBUG    |   Region near center, might be player
2025-12-02 20:35:00 | DEBUG    |   Region near center, might be player
2025-12-02 20:35:00 | INFO     |   ✓ Target #9 at (1391, 378)
2025-12-02 20:35:00 | INFO     |   ✓ Target #10 at (1814, 264)
2025-12-02 20:35:00 | DEBUG    |   Region near center, might be player
2025-12-02 20:35:00 | DEBUG    |   Name #12: Cached
2025-12-02 20:35:00 | DEBUG    |   Region near center, might be player
2025-12-02 20:35:00 | DEBUG    |   Name #14: Cached
2025-12-02 20:35:00 | INFO     |   ✓ Target #15 at (1841, 375)
2025-12-02 20:35:00 | INFO     |   ✓ Target #16 at (1819, 334)
2025-12-02 20:35:00 | INFO     |   ✓ Target #17 at (1438, 237)
2025-12-02 20:35:00 | INFO     | → Valid targets: 6
2025-12-02 20:35:00 | INFO     | 
  Verifying #1...
2025-12-02 20:35:00 | DEBUG    |     Clicking (413, 865)
2025-12-02 20:35:01 | DEBUG    |     Nameplate read in 1 attempts
2025-12-02 20:35:01 | INFO     |     ✓ Elite | HP: 69%
2025-12-02 20:35:01 | INFO     | 
  Verifying #2...
2025-12-02 20:35:01 | DEBUG    |     Clicking (1391, 408)
2025-12-02 20:35:01 | DEBUG    |     Nameplate read in 1 attempts
2025-12-02 20:35:01 | INFO     |     ✓ Elite | HP: 69%
2025-12-02 20:35:01 | INFO     | 
>>>>>>>>>>>>>>>>>>>>>>>>>>>>>>>>>>>>>>>>>>>>>>>>>>
2025-12-02 20:35:01 | INFO     | ENGAGING: Elite (HP: 69%)
2025-12-02 20:35:01 | INFO     | >>>>>>>>>>>>>>>>>>>>>>>>>>>>>>>>>>>>>>>>>>>>>>>>>>
2025-12-02 20:35:01 | INFO     |   Skill 1: 1
2025-12-02 20:35:02 | INFO     |   Skill 2: 2
2025-12-02 20:35:02 | INFO     |   Skill 3: 3
2025-12-02 20:35:03 | INFO     |   Skill 4: 4
2025-12-02 20:35:04 | INFO     | <<<<<<<<<<<<<<<<<<<<<<<<<<<<<<<<<<<<<<<<<<<<<<<<<<
2025-12-02 20:35:04 | INFO     | Total engagements: 9

2025-12-02 20:35:04 | INFO     | 
======================================================================
2025-12-02 20:35:04 | INFO     | CYCLE #12
2025-12-02 20:35:04 | INFO     | ======================================================================
2025-12-02 20:35:04 | INFO     | Detected: 26 floating names
2025-12-02 20:35:04 | INFO     |   ✓ Target #1 at (172, 844)
2025-12-02 20:35:04 | DEBUG    |   Name #2: Player zone
2025-12-02 20:35:04 | DEBUG    |   Name #3: Player zone
2025-12-02 20:35:04 | DEBUG    |   Name #4: Player zone
2025-12-02 20:35:04 | DEBUG    |   Name #5: Player zone
2025-12-02 20:35:04 | DEBUG    |   Name #6: Player zone
2025-12-02 20:35:04 | DEBUG    |   Name #7: Player zone
2025-12-02 20:35:04 | DEBUG    |   Region near center, might be player
2025-12-02 20:35:04 | DEBUG    |   Region near center, might be player
2025-12-02 20:35:04 | INFO     |   ✓ Target #10 at (1144, 308)
2025-12-02 20:35:04 | INFO     |   ✓ Target #11 at (1851, 264)
2025-12-02 20:35:04 | INFO     |   ✓ Target #12 at (1813, 258)
2025-12-02 20:35:04 | INFO     |   ✓ Target #13 at (949, 161)
2025-12-02 20:35:04 | INFO     |   ✓ Target #14 at (1598, 781)
2025-12-02 20:35:04 | DEBUG    |   Name #15: Cached
2025-12-02 20:35:04 | DEBUG    |   Region near center, might be player
2025-12-02 20:35:04 | DEBUG    |   Region near center, might be player
2025-12-02 20:35:04 | DEBUG    |   Region near center, might be player
2025-12-02 20:35:04 | DEBUG    |   Name #19: Cached
2025-12-02 20:35:04 | INFO     |   ✓ Target #20 at (1724, 312)
2025-12-02 20:35:04 | DEBUG    |   Region near center, might be player
2025-12-02 20:35:04 | DEBUG    |   Region near center, might be player
2025-12-02 20:35:04 | INFO     |   ✓ Target #23 at (1752, 368)
2025-12-02 20:35:04 | DEBUG    |   Name #24: Cached
2025-12-02 20:35:04 | INFO     |   ✓ Target #25 at (1814, 346)
2025-12-02 20:35:04 | INFO     |   ✓ Target #26 at (1346, 269)
2025-12-02 20:35:04 | INFO     | → Valid targets: 10
2025-12-02 20:35:04 | INFO     | 
  Verifying #1...
2025-12-02 20:35:04 | DEBUG    |     Clicking (172, 874)
2025-12-02 20:35:05 | DEBUG    |     Nameplate read in 1 attempts
2025-12-02 20:35:05 | INFO     |     ✓ Elite | HP: 69%
2025-12-02 20:35:05 | INFO     | 
  Verifying #2...
2025-12-02 20:35:05 | DEBUG    |     Clicking (1144, 338)
2025-12-02 20:35:05 | DEBUG    |     Nameplate read in 1 attempts
2025-12-02 20:35:05 | INFO     |     ✓ Elite | HP: 69%
2025-12-02 20:35:05 | INFO     | 
>>>>>>>>>>>>>>>>>>>>>>>>>>>>>>>>>>>>>>>>>>>>>>>>>>
2025-12-02 20:35:05 | INFO     | ENGAGING: Elite (HP: 69%)
2025-12-02 20:35:05 | INFO     | >>>>>>>>>>>>>>>>>>>>>>>>>>>>>>>>>>>>>>>>>>>>>>>>>>
2025-12-02 20:35:05 | INFO     |   Skill 1: 1
2025-12-02 20:35:06 | INFO     |   Skill 2: 2
2025-12-02 20:35:06 | INFO     |   Skill 3: 3
2025-12-02 20:35:07 | INFO     |   Skill 4: 4
2025-12-02 20:35:08 | INFO     | <<<<<<<<<<<<<<<<<<<<<<<<<<<<<<<<<<<<<<<<<<<<<<<<<<
2025-12-02 20:35:08 | INFO     | Total engagements: 10

2025-12-02 20:35:08 | INFO     | 
======================================================================
2025-12-02 20:35:08 | INFO     | CYCLE #13
2025-12-02 20:35:08 | INFO     | ======================================================================
2025-12-02 20:35:08 | INFO     | Detected: 14 floating names
2025-12-02 20:35:08 | INFO     |   ✓ Target #1 at (1561, 784)
2025-12-02 20:35:08 | DEBUG    |   Name #2: Player zone
2025-12-02 20:35:08 | DEBUG    |   Region near center, might be player
2025-12-02 20:35:08 | DEBUG    |   Region near center, might be player
2025-12-02 20:35:08 | DEBUG    |   Region near center, might be player
2025-12-02 20:35:08 | INFO     |   ✓ Target #6 at (1153, 228)
2025-12-02 20:35:08 | INFO     |   ✓ Target #7 at (969, 183)
2025-12-02 20:35:08 | INFO     |   ✓ Target #8 at (934, 183)
2025-12-02 20:35:08 | INFO     |   ✓ Target #9 at (1031, 162)
2025-12-02 20:35:08 | DEBUG    |   Name #10: Cached
2025-12-02 20:35:08 | DEBUG    |   Name #11: Cached
2025-12-02 20:35:08 | DEBUG    |   Name #12: Cached
2025-12-02 20:35:08 | DEBUG    |   Name #13: Cached
2025-12-02 20:35:08 | INFO     |   ✓ Target #14 at (999, 132)
2025-12-02 20:35:08 | INFO     | → Valid targets: 6
2025-12-02 20:35:08 | INFO     | 
  Verifying #1...
2025-12-02 20:35:08 | DEBUG    |     Clicking (1561, 814)
2025-12-02 20:35:09 | DEBUG    |     Nameplate read in 1 attempts
2025-12-02 20:35:09 | INFO     |     ✓ Elite | HP: 69%
2025-12-02 20:35:09 | INFO     | 
  Verifying #2...
2025-12-02 20:35:09 | DEBUG    |     Clicking (1153, 258)
2025-12-02 20:35:09 | DEBUG    |     Nameplate read in 1 attempts
2025-12-02 20:35:09 | INFO     |     ✓ Elite | HP: 69%
2025-12-02 20:35:09 | INFO     | 
>>>>>>>>>>>>>>>>>>>>>>>>>>>>>>>>>>>>>>>>>>>>>>>>>>
2025-12-02 20:35:09 | INFO     | ENGAGING: Elite (HP: 69%)
2025-12-02 20:35:09 | INFO     | >>>>>>>>>>>>>>>>>>>>>>>>>>>>>>>>>>>>>>>>>>>>>>>>>>
2025-12-02 20:35:09 | INFO     |   Skill 1: 1
2025-12-02 20:35:09 | INFO     | 
⏸ PAUSED - Press CapsLock to resume
2025-12-02 20:35:10 | INFO     |   Skill 2: 2
2025-12-02 20:35:10 | INFO     |   Skill 3: 3
2025-12-02 20:35:11 | INFO     |   Skill 4: 4
2025-12-02 20:35:12 | INFO     | <<<<<<<<<<<<<<<<<<<<<<<<<<<<<<<<<<<<<<<<<<<<<<<<<<
2025-12-02 20:35:12 | INFO     | Total engagements: 11

2025-12-02 20:35:13 | INFO     | Shutting down gracefully...
2025-12-02 20:35:13 | INFO     | Shutting down gracefully...
2025-12-02 20:35:13 | INFO     | 
======================================================================
2025-12-02 20:35:13 | INFO     | FINAL STATISTICS
2025-12-02 20:35:13 | INFO     | ======================================================================
2025-12-02 20:35:13 | INFO     | Total Cycles: 13
2025-12-02 20:35:13 | INFO     | Total Clicks: 24
2025-12-02 20:35:13 | INFO     | Total Engagements: 11
2025-12-02 20:35:13 | INFO     | Uptime: 51s (0m 51s)
2025-12-02 20:35:13 | INFO     | Cache Hit Rate: 24.1%
2025-12-02 20:35:13 | INFO     | Avg Cycle Time: 3.92s
2025-12-02 20:35:13 | INFO     | ======================================================================
