2025-12-11 21:54:01 | INFO     | ======================================================================
2025-12-11 21:54:01 | INFO     | MOB HUNTER v3.0 - CENTER-OUT + BINARY HEALTH
2025-12-11 21:54:01 | INFO     | ======================================================================
2025-12-11 21:54:01 | INFO     | Log directory: logs/session_20251211_215401
2025-12-11 21:54:01 | INFO     | Screen: 1920x1080
2025-12-11 21:54:01 | INFO     | Strategy: Attack closest to center first
2025-12-11 21:54:01 | INFO     | Health: Binary (ALIVE/DEAD) detection
2025-12-11 21:54:01 | INFO     | Pet Filter: Via nameplate class detection
2025-12-11 21:54:01 | INFO     | ======================================================================
2025-12-11 21:54:01 | INFO     | 
🚀 Bot started! Press Ctrl+C to stop.

2025-12-11 21:54:01 | INFO     | 💡 Controls: CapsLock = Pause/Resume | O = Toggle Overlay

2025-12-11 21:54:01 | INFO     | ⌨️  Global keyboard listener active (works in any window)

2025-12-11 21:54:01 | INFO     | 📋 Configuration:
2025-12-11 21:54:01 | INFO     |    Death Detection: ✅ Enabled
2025-12-11 21:54:01 | INFO     |    Death Screenshots: ✅ Enabled
2025-12-11 21:54:01 | INFO     |    Error Screenshots: ✅ Enabled
2025-12-11 21:54:01 | INFO     |    Periodic Screenshots: ✅ Enabled
2025-12-11 21:54:01 | INFO     |    Screenshot Interval: Every 3 cycles
2025-12-11 21:54:01 | INFO     |    Buffer Interval: 120s
2025-12-11 21:54:01 | INFO     |    Overlay: ✅ Enabled
2025-12-11 21:54:01 | INFO     | 
2025-12-11 21:54:01 | INFO     | 🖥️  Click-through overlay starting...
2025-12-11 21:54:01 | INFO     | 
🔍 Checking initial player status...
2025-12-11 21:54:01 | DEBUG    | Player health bar: 495 red pixels
2025-12-11 21:54:01 | INFO     | ✅ Player is alive - starting bot...
2025-12-11 21:54:01 | INFO     | 
Running INITIAL buffer sequence...
2025-12-11 21:54:01 | INFO     | 
============================================================
2025-12-11 21:54:01 | INFO     | RUNNING BUFFER SEQUENCE
2025-12-11 21:54:01 | INFO     | ============================================================
2025-12-11 21:54:01 | INFO     |   [1/6] Pressing: F2
2025-12-11 21:54:02 | INFO     |   [2/6] Pressing: 1
2025-12-11 21:54:02 | INFO     |   [3/6] Pressing: 2
2025-12-11 21:54:02 | INFO     |       Waiting 1.0s...
2025-12-11 21:54:02 | INFO     | ✅ Overlay is now CLICK-THROUGH and transparent
2025-12-11 21:54:03 | INFO     |   [4/6] Pressing: 3
2025-12-11 21:54:03 | INFO     |       Waiting 1.0s...
2025-12-11 21:54:04 | INFO     |   [5/6] Pressing: 4
2025-12-11 21:54:04 | INFO     |       Waiting 1.0s...
2025-12-11 21:54:05 | INFO     |   [6/6] Pressing: F1
2025-12-11 21:54:05 | INFO     | ============================================================
2025-12-11 21:54:05 | INFO     | Buffer sequence complete (Total: 1)
2025-12-11 21:54:05 | INFO     | Next buffer in 120s (2m)
2025-12-11 21:54:05 | INFO     | ============================================================

2025-12-11 21:54:05 | INFO     | 
======================================================================
2025-12-11 21:54:05 | INFO     | CYCLE #1
2025-12-11 21:54:05 | INFO     | ======================================================================
2025-12-11 21:54:05 | DEBUG    | Player health bar: 293 red pixels
2025-12-11 21:54:05 | INFO     | Detected: 2 floating names
2025-12-11 21:54:05 | INFO     | → Valid targets (after cache): 2
2025-12-11 21:54:05 | INFO     | → Target priority (closest to farthest):
2025-12-11 21:54:05 | INFO     |    #1: Distance=173px from center
2025-12-11 21:54:05 | INFO     |    #2: Distance=263px from center
2025-12-11 21:54:05 | INFO     | 
  Verifying target #1 (D=173px)...
2025-12-11 21:54:05 | DEBUG    |     Clicking (1045, 426)
2025-12-11 21:54:06 | DEBUG    |     Health check: 1356 health pixels -> ALIVE
2025-12-11 21:54:06 | DEBUG    |     ✓ Verified MOB in 1 attempts
2025-12-11 21:54:06 | INFO     |     ✓ Giant | Status: ALIVE
2025-12-11 21:54:06 | INFO     | 
>>>>>>>>>>>>>>>>>>>>>>>>>>>>>>>>>>>>>>>>>>>>>>>>>>>>>>>>>>>>
2025-12-11 21:54:06 | INFO     | ⚔️  ENGAGING: Giant
2025-12-11 21:54:06 | INFO     | >>>>>>>>>>>>>>>>>>>>>>>>>>>>>>>>>>>>>>>>>>>>>>>>>>>>>>>>>>>>
2025-12-11 21:54:06 | DEBUG    |     Initial health: 1356 red pixels
2025-12-11 21:54:06 | INFO     |   → Skill 1: 1
2025-12-11 21:54:07 | DEBUG    |     Health check: 1356 red pixels -> ALIVE
2025-12-11 21:54:07 | INFO     |   → Skill 2: 2
2025-12-11 21:54:08 | DEBUG    |     Health check: 1356 red pixels -> ALIVE
2025-12-11 21:54:08 | INFO     |   → Skill 3: 3
2025-12-11 21:54:09 | DEBUG    |     Health check: 1356 red pixels -> ALIVE
2025-12-11 21:54:09 | INFO     |   → Skill 4: 4
2025-12-11 21:54:10 | DEBUG    |     Health check: 1368 red pixels -> ALIVE
2025-12-11 21:54:10 | DEBUG    |     Health change: 1356 → 1368 (Δ=-12)
2025-12-11 21:54:10 | WARNING  |   ⚠️  Health barely changed (1356 → 1368, 0.9%) - NOT hitting mob!
2025-12-11 21:54:10 | WARNING  |   Character may be stuck or mob unreachable
2025-12-11 21:54:10 | INFO     | <<<<<<<<<<<<<<<<<<<<<<<<<<<<<<<<<<<<<<<<<<<<<<<<<<<<<<<<<<<<

2025-12-11 21:54:10 | DEBUG    |     Combat failed - trying next mob (timer reset)
2025-12-11 21:54:10 | INFO     | 
  Verifying target #2 (D=263px)...
2025-12-11 21:54:10 | DEBUG    |     Clicking (1051, 323)
2025-12-11 21:54:11 | DEBUG    |     Health check: 1983 health pixels -> ALIVE
2025-12-11 21:54:11 | DEBUG    |     ✓ Verified MOB in 1 attempts
2025-12-11 21:54:11 | INFO     |     ✓ Unique | Status: ALIVE
2025-12-11 21:54:11 | INFO     | 
>>>>>>>>>>>>>>>>>>>>>>>>>>>>>>>>>>>>>>>>>>>>>>>>>>>>>>>>>>>>
2025-12-11 21:54:11 | INFO     | ⚔️  ENGAGING: Unique
2025-12-11 21:54:11 | INFO     | >>>>>>>>>>>>>>>>>>>>>>>>>>>>>>>>>>>>>>>>>>>>>>>>>>>>>>>>>>>>
2025-12-11 21:54:11 | DEBUG    |     Initial health: 1983 red pixels
2025-12-11 21:54:11 | INFO     |   → Skill 1: 1
2025-12-11 21:54:12 | DEBUG    |     Health check: 1983 red pixels -> ALIVE
2025-12-11 21:54:12 | INFO     |   → Skill 2: 2
2025-12-11 21:54:13 | DEBUG    |     Health check: 1808 red pixels -> ALIVE
2025-12-11 21:54:13 | INFO     |   → Skill 3: 3
2025-12-11 21:54:14 | DEBUG    |     Health check: 1690 red pixels -> ALIVE
2025-12-11 21:54:14 | INFO     |   → Skill 4: 4
2025-12-11 21:54:15 | DEBUG    |     Health check: 1687 red pixels -> ALIVE
2025-12-11 21:54:15 | DEBUG    |     Health change: 1983 → 1687 (Δ=296)
2025-12-11 21:54:15 | INFO     |   ℹ️  Rotation complete (health decreased: 296 pixels)
2025-12-11 21:54:15 | INFO     | <<<<<<<<<<<<<<<<<<<<<<<<<<<<<<<<<<<<<<<<<<<<<<<<<<<<<<<<<<<<
2025-12-11 21:54:15 | INFO     | 💀 Total kills: 1
2025-12-11 21:54:15 | INFO     | <<<<<<<<<<<<<<<<<<<<<<<<<<<<<<<<<<<<<<<<<<<<<<<<<<<<<<<<<<<<

2025-12-11 21:54:15 | DEBUG    | Stuck detector: Kill recorded, timers reset
2025-12-11 21:54:16 | INFO     | 
======================================================================
2025-12-11 21:54:16 | INFO     | CYCLE #2
2025-12-11 21:54:16 | INFO     | ======================================================================
2025-12-11 21:54:16 | DEBUG    | Player health bar: 293 red pixels
2025-12-11 21:54:16 | INFO     | Detected: 2 floating names
2025-12-11 21:54:16 | INFO     | → Valid targets (after cache): 2
2025-12-11 21:54:16 | INFO     | → Target priority (closest to farthest):
2025-12-11 21:54:16 | INFO     |    #1: Distance=114px from center
2025-12-11 21:54:16 | INFO     |    #2: Distance=138px from center
2025-12-11 21:54:16 | INFO     | 
  Verifying target #1 (D=114px)...
2025-12-11 21:54:16 | DEBUG    |     Clicking (1022, 474)
2025-12-11 21:54:16 | DEBUG    |     Health check: 1356 health pixels -> ALIVE
2025-12-11 21:54:16 | DEBUG    |     ✓ Verified MOB in 1 attempts
2025-12-11 21:54:16 | INFO     |     ✓ Giant | Status: ALIVE
2025-12-11 21:54:16 | INFO     | 
>>>>>>>>>>>>>>>>>>>>>>>>>>>>>>>>>>>>>>>>>>>>>>>>>>>>>>>>>>>>
2025-12-11 21:54:16 | INFO     | ⚔️  ENGAGING: Giant
2025-12-11 21:54:16 | INFO     | >>>>>>>>>>>>>>>>>>>>>>>>>>>>>>>>>>>>>>>>>>>>>>>>>>>>>>>>>>>>
2025-12-11 21:54:16 | DEBUG    |     Initial health: 1356 red pixels
2025-12-11 21:54:16 | INFO     |   → Skill 1: 1
2025-12-11 21:54:17 | DEBUG    |     Health check: 1356 red pixels -> ALIVE
2025-12-11 21:54:17 | INFO     |   → Skill 2: 2
2025-12-11 21:54:18 | DEBUG    |     Health check: 1356 red pixels -> ALIVE
2025-12-11 21:54:18 | INFO     |   → Skill 3: 3
2025-12-11 21:54:20 | DEBUG    |     Health check: 1356 red pixels -> ALIVE
2025-12-11 21:54:20 | INFO     |   → Skill 4: 4
2025-12-11 21:54:21 | DEBUG    |     Health check: 1356 red pixels -> ALIVE
2025-12-11 21:54:21 | DEBUG    |     Health change: 1356 → 1356 (Δ=0)
2025-12-11 21:54:21 | WARNING  |   ⚠️  Health barely changed (1356 → 1356, 0.0%) - NOT hitting mob!
2025-12-11 21:54:21 | WARNING  |   Character may be stuck or mob unreachable
2025-12-11 21:54:21 | INFO     | <<<<<<<<<<<<<<<<<<<<<<<<<<<<<<<<<<<<<<<<<<<<<<<<<<<<<<<<<<<<

2025-12-11 21:54:21 | DEBUG    |     Combat failed - trying next mob (timer reset)
2025-12-11 21:54:21 | INFO     | 
  Verifying target #2 (D=138px)...
2025-12-11 21:54:21 | DEBUG    |     Clicking (1060, 474)
2025-12-11 21:54:21 | DEBUG    |     Health check: 1356 health pixels -> ALIVE
2025-12-11 21:54:21 | DEBUG    |     ✓ Verified MOB in 1 attempts
2025-12-11 21:54:21 | INFO     |     ✓ Giant | Status: ALIVE
2025-12-11 21:54:21 | INFO     | 
>>>>>>>>>>>>>>>>>>>>>>>>>>>>>>>>>>>>>>>>>>>>>>>>>>>>>>>>>>>>
2025-12-11 21:54:21 | INFO     | ⚔️  ENGAGING: Giant
2025-12-11 21:54:21 | INFO     | >>>>>>>>>>>>>>>>>>>>>>>>>>>>>>>>>>>>>>>>>>>>>>>>>>>>>>>>>>>>
2025-12-11 21:54:21 | DEBUG    |     Initial health: 1356 red pixels
2025-12-11 21:54:21 | INFO     |   → Skill 1: 1
2025-12-11 21:54:22 | DEBUG    |     Health check: 1356 red pixels -> ALIVE
2025-12-11 21:54:22 | INFO     |   → Skill 2: 2
2025-12-11 21:54:23 | DEBUG    |     Health check: 1356 red pixels -> ALIVE
2025-12-11 21:54:23 | INFO     |   → Skill 3: 3
2025-12-11 21:54:25 | DEBUG    |     Health check: 1356 red pixels -> ALIVE
2025-12-11 21:54:25 | INFO     |   → Skill 4: 4
2025-12-11 21:54:26 | DEBUG    |     Health check: 1356 red pixels -> ALIVE
2025-12-11 21:54:26 | DEBUG    |     Health change: 1356 → 1356 (Δ=0)
2025-12-11 21:54:26 | WARNING  |   ⚠️  Health barely changed (1356 → 1356, 0.0%) - NOT hitting mob!
2025-12-11 21:54:26 | WARNING  |   Character may be stuck or mob unreachable
2025-12-11 21:54:26 | INFO     | <<<<<<<<<<<<<<<<<<<<<<<<<<<<<<<<<<<<<<<<<<<<<<<<<<<<<<<<<<<<

2025-12-11 21:54:26 | DEBUG    |     Combat failed - trying next mob (timer reset)
2025-12-11 21:54:26 | INFO     | 
======================================================================
2025-12-11 21:54:26 | INFO     | CYCLE #3
2025-12-11 21:54:26 | INFO     | ======================================================================
2025-12-11 21:54:26 | DEBUG    | Player health bar: 300 red pixels
2025-12-11 21:54:26 | INFO     | Detected: 1 floating names
2025-12-11 21:54:26 | INFO     | → Valid targets (after cache): 1
2025-12-11 21:54:26 | INFO     | → Target priority (closest to farthest):
2025-12-11 21:54:26 | INFO     |    #1: Distance=762px from center
2025-12-11 21:54:26 | INFO     | 
  Verifying target #1 (D=762px)...
2025-12-11 21:54:26 | DEBUG    |     Clicking (1720, 521)
2025-12-11 21:54:27 | DEBUG    |     Health check: 1356 health pixels -> ALIVE
2025-12-11 21:54:27 | DEBUG    |     ✓ Verified MOB in 1 attempts
2025-12-11 21:54:27 | INFO     |     ✓ Giant | Status: ALIVE
2025-12-11 21:54:27 | INFO     | 
>>>>>>>>>>>>>>>>>>>>>>>>>>>>>>>>>>>>>>>>>>>>>>>>>>>>>>>>>>>>
2025-12-11 21:54:27 | INFO     | ⚔️  ENGAGING: Giant
2025-12-11 21:54:27 | INFO     | >>>>>>>>>>>>>>>>>>>>>>>>>>>>>>>>>>>>>>>>>>>>>>>>>>>>>>>>>>>>
2025-12-11 21:54:27 | DEBUG    |     Initial health: 1356 red pixels
2025-12-11 21:54:27 | INFO     |   → Skill 1: 1
2025-12-11 21:54:28 | DEBUG    |     Health check: 1356 red pixels -> ALIVE
2025-12-11 21:54:28 | INFO     |   → Skill 2: 2
2025-12-11 21:54:29 | DEBUG    |     Health check: 1356 red pixels -> ALIVE
2025-12-11 21:54:29 | INFO     |   → Skill 3: 3
2025-12-11 21:54:30 | DEBUG    |     Health check: 1356 red pixels -> ALIVE
2025-12-11 21:54:30 | INFO     |   → Skill 4: 4
2025-12-11 21:54:31 | DEBUG    |     Health check: 1356 red pixels -> ALIVE
2025-12-11 21:54:31 | DEBUG    |     Health change: 1356 → 1356 (Δ=0)
2025-12-11 21:54:31 | WARNING  |   ⚠️  Health barely changed (1356 → 1356, 0.0%) - NOT hitting mob!
2025-12-11 21:54:31 | WARNING  |   Character may be stuck or mob unreachable
2025-12-11 21:54:31 | INFO     | <<<<<<<<<<<<<<<<<<<<<<<<<<<<<<<<<<<<<<<<<<<<<<<<<<<<<<<<<<<<

2025-12-11 21:54:31 | DEBUG    |     Combat failed - trying next mob (timer reset)
2025-12-11 21:54:31 | INFO     | 📸 Screenshot saved: 0001_215431_CYCLE_cycle_3.png
2025-12-11 21:54:32 | INFO     | 
======================================================================
2025-12-11 21:54:32 | INFO     | CYCLE #4
2025-12-11 21:54:32 | INFO     | ======================================================================
2025-12-11 21:54:32 | DEBUG    | Player health bar: 300 red pixels
2025-12-11 21:54:32 | INFO     | Detected: 3 floating names
2025-12-11 21:54:32 | INFO     | → Valid targets (after cache): 3
2025-12-11 21:54:32 | INFO     | → Target priority (closest to farthest):
2025-12-11 21:54:32 | INFO     |    #1: Distance=51px from center
2025-12-11 21:54:32 | INFO     |    #2: Distance=284px from center
2025-12-11 21:54:32 | INFO     |    #3: Distance=315px from center
2025-12-11 21:54:32 | INFO     | 
  Verifying target #1 (D=51px)...
2025-12-11 21:54:32 | DEBUG    |     Clicking (990, 528)
2025-12-11 21:54:32 | DEBUG    |     Health check: 1356 health pixels -> ALIVE
2025-12-11 21:54:32 | DEBUG    |     ✓ Verified MOB in 1 attempts
2025-12-11 21:54:32 | INFO     |     ✓ Giant | Status: ALIVE
2025-12-11 21:54:32 | INFO     | 
>>>>>>>>>>>>>>>>>>>>>>>>>>>>>>>>>>>>>>>>>>>>>>>>>>>>>>>>>>>>
2025-12-11 21:54:32 | INFO     | ⚔️  ENGAGING: Giant
2025-12-11 21:54:32 | INFO     | >>>>>>>>>>>>>>>>>>>>>>>>>>>>>>>>>>>>>>>>>>>>>>>>>>>>>>>>>>>>
2025-12-11 21:54:32 | DEBUG    |     Initial health: 1356 red pixels
2025-12-11 21:54:32 | INFO     |   → Skill 1: 1
2025-12-11 21:54:33 | DEBUG    |     Health check: 1356 red pixels -> ALIVE
2025-12-11 21:54:33 | INFO     |   → Skill 2: 2
2025-12-11 21:54:34 | DEBUG    |     Health check: 1356 red pixels -> ALIVE
2025-12-11 21:54:34 | INFO     |   → Skill 3: 3
2025-12-11 21:54:35 | DEBUG    |     Health check: 1356 red pixels -> ALIVE
2025-12-11 21:54:35 | INFO     |   → Skill 4: 4
2025-12-11 21:54:37 | DEBUG    |     Health check: 1356 red pixels -> ALIVE
2025-12-11 21:54:37 | DEBUG    |     Health change: 1356 → 1356 (Δ=0)
2025-12-11 21:54:37 | WARNING  |   ⚠️  Health barely changed (1356 → 1356, 0.0%) - NOT hitting mob!
2025-12-11 21:54:37 | WARNING  |   Character may be stuck or mob unreachable
2025-12-11 21:54:37 | INFO     | <<<<<<<<<<<<<<<<<<<<<<<<<<<<<<<<<<<<<<<<<<<<<<<<<<<<<<<<<<<<

2025-12-11 21:54:37 | DEBUG    |     Combat failed - trying next mob (timer reset)
2025-12-11 21:54:37 | INFO     | 
  Verifying target #2 (D=284px)...
2025-12-11 21:54:37 | DEBUG    |     Clicking (1179, 389)
2025-12-11 21:54:37 | DEBUG    |     Health check: 1356 health pixels -> ALIVE
2025-12-11 21:54:37 | DEBUG    |     ✓ Verified MOB in 1 attempts
2025-12-11 21:54:37 | INFO     |     ✓ Giant | Status: ALIVE
2025-12-11 21:54:37 | INFO     | 
>>>>>>>>>>>>>>>>>>>>>>>>>>>>>>>>>>>>>>>>>>>>>>>>>>>>>>>>>>>>
2025-12-11 21:54:37 | INFO     | ⚔️  ENGAGING: Giant
2025-12-11 21:54:37 | INFO     | >>>>>>>>>>>>>>>>>>>>>>>>>>>>>>>>>>>>>>>>>>>>>>>>>>>>>>>>>>>>
2025-12-11 21:54:37 | DEBUG    |     Initial health: 1356 red pixels
2025-12-11 21:54:37 | INFO     |   → Skill 1: 1
2025-12-11 21:54:38 | DEBUG    |     Health check: 1356 red pixels -> ALIVE
2025-12-11 21:54:38 | INFO     |   → Skill 2: 2
2025-12-11 21:54:39 | DEBUG    |     Health check: 1356 red pixels -> ALIVE
2025-12-11 21:54:39 | INFO     |   → Skill 3: 3
2025-12-11 21:54:40 | DEBUG    |     Health check: 1356 red pixels -> ALIVE
2025-12-11 21:54:40 | INFO     |   → Skill 4: 4
2025-12-11 21:54:42 | DEBUG    |     Health check: 1356 red pixels -> ALIVE
2025-12-11 21:54:42 | DEBUG    |     Health change: 1356 → 1356 (Δ=0)
2025-12-11 21:54:42 | WARNING  |   ⚠️  Health barely changed (1356 → 1356, 0.0%) - NOT hitting mob!
2025-12-11 21:54:42 | WARNING  |   Character may be stuck or mob unreachable
2025-12-11 21:54:42 | INFO     | <<<<<<<<<<<<<<<<<<<<<<<<<<<<<<<<<<<<<<<<<<<<<<<<<<<<<<<<<<<<

2025-12-11 21:54:42 | DEBUG    |     Combat failed - trying next mob (timer reset)
2025-12-11 21:54:42 | INFO     | 
  Verifying target #3 (D=315px)...
2025-12-11 21:54:42 | DEBUG    |     Clicking (957, 255)
2025-12-11 21:54:42 | DEBUG    |     Health check: 1356 health pixels -> ALIVE
2025-12-11 21:54:42 | DEBUG    |     ✓ Verified MOB in 1 attempts
2025-12-11 21:54:42 | INFO     |     ✓ Giant | Status: ALIVE
2025-12-11 21:54:42 | INFO     | 
>>>>>>>>>>>>>>>>>>>>>>>>>>>>>>>>>>>>>>>>>>>>>>>>>>>>>>>>>>>>
2025-12-11 21:54:42 | INFO     | ⚔️  ENGAGING: Giant
2025-12-11 21:54:42 | INFO     | >>>>>>>>>>>>>>>>>>>>>>>>>>>>>>>>>>>>>>>>>>>>>>>>>>>>>>>>>>>>
2025-12-11 21:54:42 | DEBUG    |     Initial health: 1356 red pixels
2025-12-11 21:54:42 | INFO     |   → Skill 1: 1
2025-12-11 21:54:43 | DEBUG    |     Health check: 1356 red pixels -> ALIVE
2025-12-11 21:54:43 | INFO     |   → Skill 2: 2
2025-12-11 21:54:44 | DEBUG    |     Health check: 1356 red pixels -> ALIVE
2025-12-11 21:54:44 | INFO     |   → Skill 3: 3
2025-12-11 21:54:45 | DEBUG    |     Health check: 1356 red pixels -> ALIVE
2025-12-11 21:54:45 | INFO     |   → Skill 4: 4
2025-12-11 21:54:47 | DEBUG    |     Health check: 1356 red pixels -> ALIVE
2025-12-11 21:54:47 | DEBUG    |     Health change: 1356 → 1356 (Δ=0)
2025-12-11 21:54:47 | WARNING  |   ⚠️  Health barely changed (1356 → 1356, 0.0%) - NOT hitting mob!
2025-12-11 21:54:47 | WARNING  |   Character may be stuck or mob unreachable
2025-12-11 21:54:47 | INFO     | <<<<<<<<<<<<<<<<<<<<<<<<<<<<<<<<<<<<<<<<<<<<<<<<<<<<<<<<<<<<

2025-12-11 21:54:47 | DEBUG    |     Combat failed - trying next mob (timer reset)
2025-12-11 21:54:47 | INFO     | 
======================================================================
2025-12-11 21:54:47 | INFO     | CYCLE #5
2025-12-11 21:54:47 | INFO     | ======================================================================
2025-12-11 21:54:47 | DEBUG    | Player health bar: 303 red pixels
2025-12-11 21:54:47 | INFO     | Detected: 3 floating names
2025-12-11 21:54:47 | INFO     | → Valid targets (after cache): 3
2025-12-11 21:54:47 | INFO     | → Target priority (closest to farthest):
2025-12-11 21:54:47 | INFO     |    #1: Distance=373px from center
2025-12-11 21:54:47 | INFO     |    #2: Distance=584px from center
2025-12-11 21:54:47 | INFO     |    #3: Distance=874px from center
2025-12-11 21:54:47 | INFO     | 
  Verifying target #1 (D=373px)...
2025-12-11 21:54:47 | DEBUG    |     Clicking (1095, 222)
2025-12-11 21:54:47 | DEBUG    |     Health check: 1976 health pixels -> ALIVE
2025-12-11 21:54:47 | DEBUG    |     ✓ Verified MOB in 1 attempts
2025-12-11 21:54:47 | INFO     |     ✓ Unique | Status: ALIVE
2025-12-11 21:54:47 | INFO     | 
>>>>>>>>>>>>>>>>>>>>>>>>>>>>>>>>>>>>>>>>>>>>>>>>>>>>>>>>>>>>
2025-12-11 21:54:47 | INFO     | ⚔️  ENGAGING: Unique
2025-12-11 21:54:47 | INFO     | >>>>>>>>>>>>>>>>>>>>>>>>>>>>>>>>>>>>>>>>>>>>>>>>>>>>>>>>>>>>
2025-12-11 21:54:47 | DEBUG    |     Initial health: 1976 red pixels
2025-12-11 21:54:47 | INFO     |   → Skill 1: 1
2025-12-11 21:54:49 | DEBUG    |     Health check: 1976 red pixels -> ALIVE
2025-12-11 21:54:49 | INFO     |   → Skill 2: 2
2025-12-11 21:54:50 | DEBUG    |     Health check: 1976 red pixels -> ALIVE
2025-12-11 21:54:50 | INFO     |   → Skill 3: 3
2025-12-11 21:54:51 | DEBUG    |     Health check: 1976 red pixels -> ALIVE
2025-12-11 21:54:51 | INFO     |   → Skill 4: 4
2025-12-11 21:54:52 | DEBUG    |     Health check: 1976 red pixels -> ALIVE
2025-12-11 21:54:52 | DEBUG    |     Health change: 1976 → 1976 (Δ=0)
2025-12-11 21:54:52 | WARNING  |   ⚠️  Health barely changed (1976 → 1976, 0.0%) - NOT hitting mob!
2025-12-11 21:54:52 | WARNING  |   Character may be stuck or mob unreachable
2025-12-11 21:54:52 | INFO     | <<<<<<<<<<<<<<<<<<<<<<<<<<<<<<<<<<<<<<<<<<<<<<<<<<<<<<<<<<<<

2025-12-11 21:54:52 | DEBUG    |     Combat failed - trying next mob (timer reset)
2025-12-11 21:54:52 | INFO     | 
  Verifying target #2 (D=584px)...
2025-12-11 21:54:52 | DEBUG    |     Clicking (473, 892)
2025-12-11 21:54:52 | DEBUG    |     Health check: 1976 health pixels -> ALIVE
2025-12-11 21:54:52 | DEBUG    |     ✓ Verified MOB in 1 attempts
2025-12-11 21:54:52 | INFO     |     ✓ Unique | Status: ALIVE
2025-12-11 21:54:52 | INFO     | 
>>>>>>>>>>>>>>>>>>>>>>>>>>>>>>>>>>>>>>>>>>>>>>>>>>>>>>>>>>>>
2025-12-11 21:54:52 | INFO     | ⚔️  ENGAGING: Unique
2025-12-11 21:54:52 | INFO     | >>>>>>>>>>>>>>>>>>>>>>>>>>>>>>>>>>>>>>>>>>>>>>>>>>>>>>>>>>>>
2025-12-11 21:54:52 | DEBUG    |     Initial health: 1976 red pixels
2025-12-11 21:54:52 | INFO     |   → Skill 1: 1
2025-12-11 21:54:54 | DEBUG    |     Health check: 1552 red pixels -> ALIVE
2025-12-11 21:54:54 | INFO     |   → Skill 2: 2
2025-12-11 21:54:55 | DEBUG    |     Health check: 1552 red pixels -> ALIVE
2025-12-11 21:54:55 | INFO     |   → Skill 3: 3
2025-12-11 21:54:56 | DEBUG    |     Health check: 1356 red pixels -> ALIVE
2025-12-11 21:54:56 | INFO     |   → Skill 4: 4
2025-12-11 21:54:57 | DEBUG    |     Health check: 1356 red pixels -> ALIVE
2025-12-11 21:54:57 | DEBUG    |     Health change: 1976 → 1356 (Δ=620)
2025-12-11 21:54:57 | INFO     |   ℹ️  Rotation complete (health decreased: 620 pixels)
2025-12-11 21:54:57 | INFO     | <<<<<<<<<<<<<<<<<<<<<<<<<<<<<<<<<<<<<<<<<<<<<<<<<<<<<<<<<<<<
2025-12-11 21:54:57 | INFO     | 💀 Total kills: 2
2025-12-11 21:54:57 | INFO     | <<<<<<<<<<<<<<<<<<<<<<<<<<<<<<<<<<<<<<<<<<<<<<<<<<<<<<<<<<<<

2025-12-11 21:54:57 | DEBUG    | Stuck detector: Kill recorded, timers reset
2025-12-11 21:54:57 | INFO     | 
  Verifying target #3 (D=874px)...
2025-12-11 21:54:57 | DEBUG    |     Clicking (108, 373)
2025-12-11 21:54:57 | DEBUG    |     Health check: 1356 health pixels -> ALIVE
2025-12-11 21:54:57 | DEBUG    |     ✓ Verified MOB in 1 attempts
2025-12-11 21:54:57 | INFO     |     ✓ Giant | Status: ALIVE
2025-12-11 21:54:57 | INFO     | 
>>>>>>>>>>>>>>>>>>>>>>>>>>>>>>>>>>>>>>>>>>>>>>>>>>>>>>>>>>>>
2025-12-11 21:54:57 | INFO     | ⚔️  ENGAGING: Giant
2025-12-11 21:54:57 | INFO     | >>>>>>>>>>>>>>>>>>>>>>>>>>>>>>>>>>>>>>>>>>>>>>>>>>>>>>>>>>>>
2025-12-11 21:54:57 | DEBUG    |     Initial health: 1356 red pixels
2025-12-11 21:54:57 | INFO     |   → Skill 1: 1
2025-12-11 21:54:58 | DEBUG    |     Health check: 1356 red pixels -> ALIVE
2025-12-11 21:54:58 | INFO     |   → Skill 2: 2
2025-12-11 21:55:00 | DEBUG    |     Health check: 1356 red pixels -> ALIVE
2025-12-11 21:55:00 | INFO     |   → Skill 3: 3
2025-12-11 21:55:01 | DEBUG    |     Health check: 1356 red pixels -> ALIVE
2025-12-11 21:55:01 | INFO     |   → Skill 4: 4
2025-12-11 21:55:02 | DEBUG    |     Health check: 1356 red pixels -> ALIVE
2025-12-11 21:55:02 | DEBUG    |     Health change: 1356 → 1356 (Δ=0)
2025-12-11 21:55:02 | WARNING  |   ⚠️  Health barely changed (1356 → 1356, 0.0%) - NOT hitting mob!
2025-12-11 21:55:02 | WARNING  |   Character may be stuck or mob unreachable
2025-12-11 21:55:02 | INFO     | <<<<<<<<<<<<<<<<<<<<<<<<<<<<<<<<<<<<<<<<<<<<<<<<<<<<<<<<<<<<

2025-12-11 21:55:02 | DEBUG    |     Combat failed - trying next mob (timer reset)
2025-12-11 21:55:02 | INFO     | 
======================================================================
2025-12-11 21:55:02 | INFO     | CYCLE #6
2025-12-11 21:55:02 | INFO     | ======================================================================
2025-12-11 21:55:02 | DEBUG    | Player health bar: 293 red pixels
2025-12-11 21:55:02 | INFO     | Detected: 3 floating names
2025-12-11 21:55:02 | INFO     | → Valid targets (after cache): 3
2025-12-11 21:55:02 | INFO     | → Target priority (closest to farthest):
2025-12-11 21:55:02 | INFO     |    #1: Distance=58px from center
2025-12-11 21:55:02 | INFO     |    #2: Distance=610px from center
2025-12-11 21:55:02 | INFO     |    #3: Distance=717px from center
2025-12-11 21:55:02 | INFO     | 
  Verifying target #1 (D=58px)...
2025-12-11 21:55:02 | DEBUG    |     Clicking (1016, 553)
2025-12-11 21:55:03 | DEBUG    |     Health check: 1356 health pixels -> ALIVE
2025-12-11 21:55:03 | DEBUG    |     ✓ Verified MOB in 1 attempts
2025-12-11 21:55:03 | INFO     |     ✓ Giant | Status: ALIVE
2025-12-11 21:55:03 | INFO     | 
>>>>>>>>>>>>>>>>>>>>>>>>>>>>>>>>>>>>>>>>>>>>>>>>>>>>>>>>>>>>
2025-12-11 21:55:03 | INFO     | ⚔️  ENGAGING: Giant
2025-12-11 21:55:03 | INFO     | >>>>>>>>>>>>>>>>>>>>>>>>>>>>>>>>>>>>>>>>>>>>>>>>>>>>>>>>>>>>
2025-12-11 21:55:03 | DEBUG    |     Initial health: 1356 red pixels
2025-12-11 21:55:03 | INFO     |   → Skill 1: 1
2025-12-11 21:55:04 | DEBUG    |     Health check: 1356 red pixels -> ALIVE
2025-12-11 21:55:04 | INFO     |   → Skill 2: 2
2025-12-11 21:55:05 | DEBUG    |     Health check: 1356 red pixels -> ALIVE
2025-12-11 21:55:05 | INFO     |   → Skill 3: 3
2025-12-11 21:55:06 | DEBUG    |     Health check: 1356 red pixels -> ALIVE
2025-12-11 21:55:06 | INFO     |   → Skill 4: 4
2025-12-11 21:55:07 | DEBUG    |     Health check: 1356 red pixels -> ALIVE
2025-12-11 21:55:07 | DEBUG    |     Health change: 1356 → 1356 (Δ=0)
2025-12-11 21:55:07 | WARNING  |   ⚠️  Health barely changed (1356 → 1356, 0.0%) - NOT hitting mob!
2025-12-11 21:55:07 | WARNING  |   Character may be stuck or mob unreachable
2025-12-11 21:55:07 | INFO     | <<<<<<<<<<<<<<<<<<<<<<<<<<<<<<<<<<<<<<<<<<<<<<<<<<<<<<<<<<<<

2025-12-11 21:55:07 | DEBUG    |     Combat failed - trying next mob (timer reset)
2025-12-11 21:55:07 | INFO     | 
  Verifying target #2 (D=610px)...
2025-12-11 21:55:07 | DEBUG    |     Clicking (1441, 194)
2025-12-11 21:55:08 | DEBUG    |     Health check: 1976 health pixels -> ALIVE
2025-12-11 21:55:08 | DEBUG    |     ✓ Verified MOB in 1 attempts
2025-12-11 21:55:08 | INFO     |     ✓ Unique | Status: ALIVE
2025-12-11 21:55:08 | INFO     | 
>>>>>>>>>>>>>>>>>>>>>>>>>>>>>>>>>>>>>>>>>>>>>>>>>>>>>>>>>>>>
2025-12-11 21:55:08 | INFO     | ⚔️  ENGAGING: Unique
2025-12-11 21:55:08 | INFO     | >>>>>>>>>>>>>>>>>>>>>>>>>>>>>>>>>>>>>>>>>>>>>>>>>>>>>>>>>>>>
2025-12-11 21:55:08 | DEBUG    |     Initial health: 1976 red pixels
2025-12-11 21:55:08 | INFO     |   → Skill 1: 1
2025-12-11 21:55:09 | DEBUG    |     Health check: 1976 red pixels -> ALIVE
2025-12-11 21:55:09 | INFO     |   → Skill 2: 2
2025-12-11 21:55:10 | DEBUG    |     Health check: 1976 red pixels -> ALIVE
2025-12-11 21:55:10 | INFO     |   → Skill 3: 3
2025-12-11 21:55:11 | DEBUG    |     Health check: 1976 red pixels -> ALIVE
2025-12-11 21:55:11 | INFO     |   → Skill 4: 4
2025-12-11 21:55:12 | DEBUG    |     Health check: 1654 red pixels -> ALIVE
2025-12-11 21:55:12 | DEBUG    |     Health change: 1976 → 1654 (Δ=322)
2025-12-11 21:55:12 | INFO     |   ℹ️  Rotation complete (health decreased: 322 pixels)
2025-12-11 21:55:12 | INFO     | <<<<<<<<<<<<<<<<<<<<<<<<<<<<<<<<<<<<<<<<<<<<<<<<<<<<<<<<<<<<
2025-12-11 21:55:12 | INFO     | 💀 Total kills: 3
2025-12-11 21:55:12 | INFO     | <<<<<<<<<<<<<<<<<<<<<<<<<<<<<<<<<<<<<<<<<<<<<<<<<<<<<<<<<<<<

2025-12-11 21:55:12 | DEBUG    | Stuck detector: Kill recorded, timers reset
2025-12-11 21:55:12 | INFO     | 
  Verifying target #3 (D=717px)...
2025-12-11 21:55:12 | DEBUG    |     Clicking (1654, 752)
2025-12-11 21:55:13 | DEBUG    |     Health check: 1654 health pixels -> ALIVE
2025-12-11 21:55:13 | DEBUG    |     ✓ Verified MOB in 1 attempts
2025-12-11 21:55:13 | INFO     |     ✓ Unique | Status: ALIVE
2025-12-11 21:55:13 | INFO     | 
>>>>>>>>>>>>>>>>>>>>>>>>>>>>>>>>>>>>>>>>>>>>>>>>>>>>>>>>>>>>
2025-12-11 21:55:13 | INFO     | ⚔️  ENGAGING: Unique
2025-12-11 21:55:13 | INFO     | >>>>>>>>>>>>>>>>>>>>>>>>>>>>>>>>>>>>>>>>>>>>>>>>>>>>>>>>>>>>
2025-12-11 21:55:13 | DEBUG    |     Initial health: 1654 red pixels
2025-12-11 21:55:13 | INFO     |   → Skill 1: 1
2025-12-11 21:55:14 | DEBUG    |     Health check: 1663 red pixels -> ALIVE
2025-12-11 21:55:14 | INFO     |   → Skill 2: 2
2025-12-11 21:55:15 | DEBUG    |     Health check: 1356 red pixels -> ALIVE
2025-12-11 21:55:15 | INFO     |   → Skill 3: 3
2025-12-11 21:55:16 | DEBUG    |     Health check: 1356 red pixels -> ALIVE
2025-12-11 21:55:16 | INFO     |   → Skill 4: 4
2025-12-11 21:55:17 | DEBUG    |     Health check: 1356 red pixels -> ALIVE
2025-12-11 21:55:17 | DEBUG    |     Health change: 1654 → 1356 (Δ=298)
2025-12-11 21:55:17 | INFO     |   ℹ️  Rotation complete (health decreased: 307 pixels)
2025-12-11 21:55:17 | INFO     | <<<<<<<<<<<<<<<<<<<<<<<<<<<<<<<<<<<<<<<<<<<<<<<<<<<<<<<<<<<<
2025-12-11 21:55:17 | INFO     | 💀 Total kills: 4
2025-12-11 21:55:17 | INFO     | <<<<<<<<<<<<<<<<<<<<<<<<<<<<<<<<<<<<<<<<<<<<<<<<<<<<<<<<<<<<

2025-12-11 21:55:17 | DEBUG    | Stuck detector: Kill recorded, timers reset
2025-12-11 21:55:17 | INFO     | 📸 Screenshot saved: 0002_215517_CYCLE_cycle_6.png
2025-12-11 21:55:18 | INFO     | 
======================================================================
2025-12-11 21:55:18 | INFO     | CYCLE #7
2025-12-11 21:55:18 | INFO     | ======================================================================
2025-12-11 21:55:18 | DEBUG    | Player health bar: 293 red pixels
2025-12-11 21:55:18 | INFO     | Detected: 13 floating names
2025-12-11 21:55:18 | DEBUG    |   Name #6: Cached, skipping
2025-12-11 21:55:18 | DEBUG    |   Name #12: Cached, skipping
2025-12-11 21:55:18 | INFO     | → Valid targets (after cache): 11
2025-12-11 21:55:18 | INFO     | → Target priority (closest to farthest):
2025-12-11 21:55:18 | INFO     |    #1: Distance=87px from center
2025-12-11 21:55:18 | INFO     |    #2: Distance=246px from center
2025-12-11 21:55:18 | INFO     |    #3: Distance=256px from center
2025-12-11 21:55:18 | INFO     |    #4: Distance=280px from center
2025-12-11 21:55:18 | INFO     |    #5: Distance=306px from center
2025-12-11 21:55:18 | INFO     | 
  Verifying target #1 (D=87px)...
2025-12-11 21:55:18 | DEBUG    |     Clicking (1017, 636)
2025-12-11 21:55:18 | DEBUG    |     Health check: 1976 health pixels -> ALIVE
2025-12-11 21:55:18 | DEBUG    |     ✓ Verified MOB in 1 attempts
2025-12-11 21:55:18 | INFO     |     ✓ Unique | Status: ALIVE
2025-12-11 21:55:18 | INFO     | 
>>>>>>>>>>>>>>>>>>>>>>>>>>>>>>>>>>>>>>>>>>>>>>>>>>>>>>>>>>>>
2025-12-11 21:55:18 | INFO     | ⚔️  ENGAGING: Unique
2025-12-11 21:55:18 | INFO     | >>>>>>>>>>>>>>>>>>>>>>>>>>>>>>>>>>>>>>>>>>>>>>>>>>>>>>>>>>>>
2025-12-11 21:55:18 | DEBUG    |     Initial health: 1976 red pixels
2025-12-11 21:55:18 | INFO     |   → Skill 1: 1
2025-12-11 21:55:19 | DEBUG    |     Health check: 1976 red pixels -> ALIVE
2025-12-11 21:55:19 | INFO     |   → Skill 2: 2
2025-12-11 21:55:20 | DEBUG    |     Health check: 1976 red pixels -> ALIVE
2025-12-11 21:55:20 | INFO     |   → Skill 3: 3
2025-12-11 21:55:22 | DEBUG    |     Health check: 1606 red pixels -> ALIVE
2025-12-11 21:55:22 | INFO     |   → Skill 4: 4
2025-12-11 21:55:23 | DEBUG    |     Health check: 1606 red pixels -> ALIVE
2025-12-11 21:55:23 | DEBUG    |     Health change: 1976 → 1606 (Δ=370)
2025-12-11 21:55:23 | INFO     |   ℹ️  Rotation complete (health decreased: 370 pixels)
2025-12-11 21:55:23 | INFO     | <<<<<<<<<<<<<<<<<<<<<<<<<<<<<<<<<<<<<<<<<<<<<<<<<<<<<<<<<<<<
2025-12-11 21:55:23 | INFO     | 💀 Total kills: 5
2025-12-11 21:55:23 | INFO     | <<<<<<<<<<<<<<<<<<<<<<<<<<<<<<<<<<<<<<<<<<<<<<<<<<<<<<<<<<<<

2025-12-11 21:55:23 | DEBUG    | Stuck detector: Kill recorded, timers reset
2025-12-11 21:55:23 | INFO     | 
  Verifying target #2 (D=246px)...
2025-12-11 21:55:23 | DEBUG    |     Clicking (874, 339)
2025-12-11 21:55:23 | DEBUG    |     Health check: 1606 health pixels -> ALIVE
2025-12-11 21:55:23 | DEBUG    |     ✓ Verified MOB in 1 attempts
2025-12-11 21:55:23 | INFO     |     ✓ Unique | Status: ALIVE
2025-12-11 21:55:23 | INFO     | 
>>>>>>>>>>>>>>>>>>>>>>>>>>>>>>>>>>>>>>>>>>>>>>>>>>>>>>>>>>>>
2025-12-11 21:55:23 | INFO     | ⚔️  ENGAGING: Unique
2025-12-11 21:55:23 | INFO     | >>>>>>>>>>>>>>>>>>>>>>>>>>>>>>>>>>>>>>>>>>>>>>>>>>>>>>>>>>>>
2025-12-11 21:55:23 | DEBUG    |     Initial health: 1606 red pixels
2025-12-11 21:55:23 | INFO     |   → Skill 1: 1
2025-12-11 21:55:24 | DEBUG    |     Health check: 1356 red pixels -> ALIVE
2025-12-11 21:55:24 | INFO     |   → Skill 2: 2
2025-12-11 21:55:25 | DEBUG    |     Health check: 1356 red pixels -> ALIVE
2025-12-11 21:55:25 | INFO     |   → Skill 3: 3
2025-12-11 21:55:27 | DEBUG    |     Health check: 1356 red pixels -> ALIVE
2025-12-11 21:55:27 | INFO     |   → Skill 4: 4
2025-12-11 21:55:28 | DEBUG    |     Health check: 1356 red pixels -> ALIVE
2025-12-11 21:55:28 | DEBUG    |     Health change: 1606 → 1356 (Δ=250)
2025-12-11 21:55:28 | INFO     |   ℹ️  Rotation complete (health decreased: 250 pixels)
2025-12-11 21:55:28 | INFO     | <<<<<<<<<<<<<<<<<<<<<<<<<<<<<<<<<<<<<<<<<<<<<<<<<<<<<<<<<<<<
2025-12-11 21:55:28 | INFO     | 💀 Total kills: 6
2025-12-11 21:55:28 | INFO     | <<<<<<<<<<<<<<<<<<<<<<<<<<<<<<<<<<<<<<<<<<<<<<<<<<<<<<<<<<<<

2025-12-11 21:55:28 | DEBUG    | Stuck detector: Kill recorded, timers reset
2025-12-11 21:55:28 | INFO     | 
  Verifying target #3 (D=256px)...
2025-12-11 21:55:28 | DEBUG    |     Clicking (972, 314)
2025-12-11 21:55:28 | DEBUG    |     Health check: 1356 health pixels -> ALIVE
2025-12-11 21:55:28 | DEBUG    |     ✓ Verified MOB in 1 attempts
2025-12-11 21:55:28 | INFO     |     ✓ Giant | Status: ALIVE
2025-12-11 21:55:28 | INFO     | 
>>>>>>>>>>>>>>>>>>>>>>>>>>>>>>>>>>>>>>>>>>>>>>>>>>>>>>>>>>>>
2025-12-11 21:55:28 | INFO     | ⚔️  ENGAGING: Giant
2025-12-11 21:55:28 | INFO     | >>>>>>>>>>>>>>>>>>>>>>>>>>>>>>>>>>>>>>>>>>>>>>>>>>>>>>>>>>>>
2025-12-11 21:55:28 | DEBUG    |     Initial health: 1356 red pixels
2025-12-11 21:55:28 | INFO     |   → Skill 1: 1
2025-12-11 21:55:29 | DEBUG    |     Health check: 1356 red pixels -> ALIVE
2025-12-11 21:55:29 | INFO     |   → Skill 2: 2
2025-12-11 21:55:30 | DEBUG    |     Health check: 1356 red pixels -> ALIVE
2025-12-11 21:55:30 | INFO     |   → Skill 3: 3
2025-12-11 21:55:32 | DEBUG    |     Health check: 1356 red pixels -> ALIVE
2025-12-11 21:55:32 | INFO     |   → Skill 4: 4
2025-12-11 21:55:33 | DEBUG    |     Health check: 1356 red pixels -> ALIVE
2025-12-11 21:55:33 | DEBUG    |     Health change: 1356 → 1356 (Δ=0)
2025-12-11 21:55:33 | WARNING  |   ⚠️  Health barely changed (1356 → 1356, 0.0%) - NOT hitting mob!
2025-12-11 21:55:33 | WARNING  |   Character may be stuck or mob unreachable
2025-12-11 21:55:33 | INFO     | <<<<<<<<<<<<<<<<<<<<<<<<<<<<<<<<<<<<<<<<<<<<<<<<<<<<<<<<<<<<

2025-12-11 21:55:33 | DEBUG    |     Combat failed - trying next mob (timer reset)
2025-12-11 21:55:33 | INFO     | 
======================================================================
2025-12-11 21:55:33 | INFO     | CYCLE #8
2025-12-11 21:55:33 | INFO     | ======================================================================
2025-12-11 21:55:33 | DEBUG    | Player health bar: 309 red pixels
2025-12-11 21:55:33 | INFO     | Detected: 12 floating names
2025-12-11 21:55:33 | INFO     | → Valid targets (after cache): 12
2025-12-11 21:55:33 | INFO     | → Target priority (closest to farthest):
2025-12-11 21:55:33 | INFO     |    #1: Distance=15px from center
2025-12-11 21:55:33 | INFO     |    #2: Distance=57px from center
2025-12-11 21:55:33 | INFO     |    #3: Distance=98px from center
2025-12-11 21:55:33 | INFO     |    #4: Distance=143px from center
2025-12-11 21:55:33 | INFO     |    #5: Distance=262px from center
2025-12-11 21:55:33 | INFO     | 
  Verifying target #1 (D=15px)...
2025-12-11 21:55:33 | DEBUG    |     Clicking (960, 597)
2025-12-11 21:55:33 | DEBUG    |     Health check: 1356 health pixels -> ALIVE
2025-12-11 21:55:33 | DEBUG    |     ✓ Verified MOB in 1 attempts
2025-12-11 21:55:33 | INFO     |     ✓ Champion | Status: ALIVE
2025-12-11 21:55:33 | INFO     | 
>>>>>>>>>>>>>>>>>>>>>>>>>>>>>>>>>>>>>>>>>>>>>>>>>>>>>>>>>>>>
2025-12-11 21:55:33 | INFO     | ⚔️  ENGAGING: Champion
2025-12-11 21:55:33 | INFO     | >>>>>>>>>>>>>>>>>>>>>>>>>>>>>>>>>>>>>>>>>>>>>>>>>>>>>>>>>>>>
2025-12-11 21:55:34 | DEBUG    |     Initial health: 1356 red pixels
2025-12-11 21:55:34 | INFO     |   → Skill 1: 1
2025-12-11 21:55:35 | DEBUG    |     Health check: 1356 red pixels -> ALIVE
2025-12-11 21:55:35 | INFO     |   → Skill 2: 2
2025-12-11 21:55:36 | DEBUG    |     Health check: 1356 red pixels -> ALIVE
2025-12-11 21:55:36 | INFO     |   → Skill 3: 3
2025-12-11 21:55:37 | DEBUG    |     Health check: 1356 red pixels -> ALIVE
2025-12-11 21:55:37 | INFO     |   → Skill 4: 4
2025-12-11 21:55:38 | DEBUG    |     Health check: 1356 red pixels -> ALIVE
2025-12-11 21:55:38 | DEBUG    |     Health change: 1356 → 1356 (Δ=0)
2025-12-11 21:55:38 | WARNING  |   ⚠️  Health barely changed (1356 → 1356, 0.0%) - NOT hitting mob!
2025-12-11 21:55:38 | WARNING  |   Character may be stuck or mob unreachable
2025-12-11 21:55:38 | INFO     | <<<<<<<<<<<<<<<<<<<<<<<<<<<<<<<<<<<<<<<<<<<<<<<<<<<<<<<<<<<<

2025-12-11 21:55:38 | DEBUG    |     Combat failed - trying next mob (timer reset)
2025-12-11 21:55:38 | INFO     | 
  Verifying target #2 (D=57px)...
2025-12-11 21:55:38 | DEBUG    |     Clicking (989, 520)
2025-12-11 21:55:38 | DEBUG    |     Health check: 1356 health pixels -> ALIVE
2025-12-11 21:55:38 | DEBUG    |     ✓ Verified MOB in 1 attempts
2025-12-11 21:55:38 | INFO     |     ✓ Giant | Status: ALIVE
2025-12-11 21:55:38 | INFO     | 
>>>>>>>>>>>>>>>>>>>>>>>>>>>>>>>>>>>>>>>>>>>>>>>>>>>>>>>>>>>>
2025-12-11 21:55:38 | INFO     | ⚔️  ENGAGING: Giant
2025-12-11 21:55:38 | INFO     | >>>>>>>>>>>>>>>>>>>>>>>>>>>>>>>>>>>>>>>>>>>>>>>>>>>>>>>>>>>>
2025-12-11 21:55:38 | DEBUG    |     Initial health: 1356 red pixels
2025-12-11 21:55:38 | INFO     |   → Skill 1: 1
2025-12-11 21:55:40 | DEBUG    |     Health check: 1356 red pixels -> ALIVE
2025-12-11 21:55:40 | INFO     |   → Skill 2: 2
2025-12-11 21:55:41 | DEBUG    |     Health check: 1356 red pixels -> ALIVE
2025-12-11 21:55:41 | INFO     |   → Skill 3: 3
2025-12-11 21:55:42 | DEBUG    |     Health check: 1356 red pixels -> ALIVE
2025-12-11 21:55:42 | INFO     |   → Skill 4: 4
2025-12-11 21:55:43 | DEBUG    |     Health check: 1356 red pixels -> ALIVE
2025-12-11 21:55:43 | DEBUG    |     Health change: 1356 → 1356 (Δ=0)
2025-12-11 21:55:43 | WARNING  |   ⚠️  Health barely changed (1356 → 1356, 0.0%) - NOT hitting mob!
2025-12-11 21:55:43 | WARNING  |   Character may be stuck or mob unreachable
2025-12-11 21:55:43 | INFO     | <<<<<<<<<<<<<<<<<<<<<<<<<<<<<<<<<<<<<<<<<<<<<<<<<<<<<<<<<<<<

2025-12-11 21:55:43 | DEBUG    |     Combat failed - trying next mob (timer reset)
2025-12-11 21:55:43 | INFO     | 
  Verifying target #3 (D=98px)...
2025-12-11 21:55:43 | DEBUG    |     Clicking (1013, 658)
2025-12-11 21:55:43 | DEBUG    |     Health check: 1356 health pixels -> ALIVE
2025-12-11 21:55:43 | DEBUG    |     ✓ Verified MOB in 1 attempts
2025-12-11 21:55:43 | INFO     |     ✓ Champion | Status: ALIVE
2025-12-11 21:55:43 | INFO     | 
>>>>>>>>>>>>>>>>>>>>>>>>>>>>>>>>>>>>>>>>>>>>>>>>>>>>>>>>>>>>
2025-12-11 21:55:43 | INFO     | ⚔️  ENGAGING: Champion
2025-12-11 21:55:43 | INFO     | >>>>>>>>>>>>>>>>>>>>>>>>>>>>>>>>>>>>>>>>>>>>>>>>>>>>>>>>>>>>
2025-12-11 21:55:43 | DEBUG    |     Initial health: 1356 red pixels
2025-12-11 21:55:43 | INFO     |   → Skill 1: 1
2025-12-11 21:55:45 | DEBUG    |     Health check: 1356 red pixels -> ALIVE
2025-12-11 21:55:45 | INFO     |   → Skill 2: 2
2025-12-11 21:55:46 | DEBUG    |     Health check: 1356 red pixels -> ALIVE
2025-12-11 21:55:46 | INFO     |   → Skill 3: 3
2025-12-11 21:55:47 | DEBUG    |     Health check: 1356 red pixels -> ALIVE
2025-12-11 21:55:47 | INFO     |   → Skill 4: 4
2025-12-11 21:55:48 | DEBUG    |     Health check: 1356 red pixels -> ALIVE
2025-12-11 21:55:48 | DEBUG    |     Health change: 1356 → 1356 (Δ=0)
2025-12-11 21:55:48 | WARNING  |   ⚠️  Health barely changed (1356 → 1356, 0.0%) - NOT hitting mob!
2025-12-11 21:55:48 | WARNING  |   Character may be stuck or mob unreachable
2025-12-11 21:55:48 | INFO     | <<<<<<<<<<<<<<<<<<<<<<<<<<<<<<<<<<<<<<<<<<<<<<<<<<<<<<<<<<<<

2025-12-11 21:55:48 | DEBUG    |     Combat failed - trying next mob (timer reset)
2025-12-11 21:55:48 | INFO     | 
⏸️  PAUSED - Press CapsLock to resume

2025-12-11 21:55:50 | INFO     | 

⛔ Bot stopped by user
2025-12-11 21:55:50 | INFO     | 
======================================================================
2025-12-11 21:55:50 | INFO     | 📊 FINAL STATISTICS
2025-12-11 21:55:50 | INFO     | ======================================================================
2025-12-11 21:55:50 | INFO     | 📁 Log Directory: logs/session_20251211_215401
2025-12-11 21:55:50 | INFO     | ⏱️  Uptime: 108s (1m 48s)
2025-12-11 21:55:50 | INFO     | 🔄 Total Cycles: 8
2025-12-11 21:55:50 | INFO     | 📸 Screenshots Saved: 2
2025-12-11 21:55:50 | INFO     | 
2025-12-11 21:55:50 | INFO     | 🔍 Detection:
2025-12-11 21:55:50 | INFO     |    Total Clicks: 20
2025-12-11 21:55:50 | INFO     |    Verified Mobs: 20
2025-12-11 21:55:50 | INFO     |    Filtered Pets: 0
2025-12-11 21:55:50 | INFO     |    Pet Filter Rate: 0.0%
2025-12-11 21:55:50 | INFO     | 
2025-12-11 21:55:50 | INFO     | ⚔️  Combat:
2025-12-11 21:55:50 | INFO     |    Total Kills: 6
2025-12-11 21:55:50 | INFO     |    Deaths: 0
2025-12-11 21:55:50 | INFO     |    Early Stops: 0
2025-12-11 21:55:50 | INFO     |    Skills Used: 80
2025-12-11 21:55:50 | INFO     |    Avg Skills/Kill: 13.3
2025-12-11 21:55:50 | INFO     |    Kills/Hour: 200.0
2025-12-11 21:55:50 | INFO     | 
2025-12-11 21:55:50 | INFO     | ⚙️  System:
2025-12-11 21:55:50 | INFO     |    Buffer Sequences: 1
2025-12-11 21:55:50 | INFO     |    Stuck Recoveries: 0
2025-12-11 21:55:50 | INFO     |    Cache Hit Rate: 5.1%
2025-12-11 21:55:50 | INFO     |    Cache Size: 12 entries
2025-12-11 21:55:50 | INFO     | 
2025-12-11 21:55:50 | INFO     | 📈 Efficiency:
2025-12-11 21:55:50 | INFO     |    Avg Cycle Time: 13.50s
2025-12-11 21:55:50 | INFO     |    Avg Clicks/Cycle: 2.5
2025-12-11 21:55:50 | INFO     |    Avg Kills/Cycle: 0.75
2025-12-11 21:55:50 | INFO     | ======================================================================
